selftext,title,id,sorted_by,num_comments,score,ups,downs
,Another one thinking he is a genious,asv5nr,new,15.0,15.0,15.0,0.0
,"""But were nonviolent""",astdk1,new,5.0,8.0,8.0,0.0
,"Probably a LARP as I imagine the only thing he actually lifts is Cheeto packets. However if true, I hope the next woman be tries it with gives him what he deserves...",asuivu,new,11.0,10.0,10.0,0.0
,Because of course he’s entitled to a woman’s body if someone else has had it.,asu22p,new,18.0,12.0,12.0,0.0
,They bring so much of their unhappiness upon themselves,asu1o5,new,9.0,11.0,11.0,0.0
,"incel worried about an epidemic of ""open mouthed skinny framed"" guys",asu1f0,new,1.0,5.0,5.0,0.0
,lol. Damn bitch you okay?? (Foaming at the mouth for no reason),astlqg,new,13.0,7.0,7.0,0.0
,"""clothes. But her bone structure is terrible, if she was born male, she would be extremely repulsive and for sure involuntary adult virgin""",astj4i,new,6.0,12.0,12.0,0.0
,An incels view on feminism. “Recriminalize homosexual acts publicly...” and “publicly humiliate them whilst this punishment takes place.”,assvga,new,35.0,35.0,35.0,0.0
,"“Females are the problem, not males.”",asss55,new,10.0,5.0,5.0,0.0
,Incel goes outside and overhears a conversation that had nothing to do with him and takes personal offense.,assqvx,new,6.0,11.0,11.0,0.0
,"Incel blaming genetics while at the same time refusing to work on himself, you ain’t gonna get anywhere by doing that.",assno9,new,10.0,22.0,22.0,0.0
,Y'all know there's a new sub right?,assgyw,new,30.0,67.0,67.0,0.0
,Incel discussing women like a 15th century explorer who found a secret map to a new continent.,aspy0f,new,37.0,21.0,21.0,0.0
,"When called an incel for saying women shouldn’t have the right to vote, this is how he responded",asqrzo,new,393.0,805.0,805.0,0.0
,"""Same with incels, therapy will not help nor will anti depressants because they both ignore the underlying problem which is the fact that the person is objectively ugly""",asq40n,new,48.0,24.0,24.0,0.0
,Incel compares himself to the persecution of Jews and African Americans,asojke,new,318.0,2201.0,2201.0,0.0
,This dude's worldview is pretty clearly expressed in the articles he writes...,aso5w0,new,42.0,98.0,98.0,0.0
,This sick fuck,asn82x,new,44.0,104.0,104.0,0.0
,Friend got cornered in a bathroom at work by creeper she had previously lightly flirted with. Green commenter’s “liked” pages are things like “feminism is sexism” and “Support Kevin Spacey”.,asmn40,new,7.0,29.0,29.0,0.0
,"""Non-monogmamous whores need not apply"".. So much for going their own way.",asmif0,new,154.0,275.0,275.0,0.0
,"Yes, Id much rather be slapped than have you tell me you’d like to steal my hair or some shit.",asjlvx,new,5.0,16.0,16.0,0.0
,You can’t win when you win,asiihj,new,11.0,21.0,21.0,0.0
,A guy posted in an Incel page asking how to raise his 9 year old and 10 year old daughters. This was one of the responses.,ash45j,new,10.0,10.0,10.0,0.0
,Wild Incel gives his opinion on single mothers,asfulj,new,6.0,29.0,29.0,0.0
,I’ve found some in the wild!,ashvy7,new,18.0,34.0,34.0,0.0
,Because porn is so reliable and real.,ase4un,new,15.0,15.0,15.0,0.0
,"“MaRrIAgE Is SLaVeRy, IvE bEEn BlaCkpiLlEd You BeTA CucKS”",asjt14,new,10.0,11.0,11.0,0.0
,Incels can’t take a joke,asl7x8,new,34.0,6.0,6.0,0.0
,Do we have an inside man???,aschsf,new,11.0,16.0,16.0,0.0
,Incel believes people only care about suicide because of the M A T R I A R C H Y,aschq7,new,9.0,15.0,15.0,0.0
,Another zinger,asc69p,new,7.0,16.0,16.0,0.0
,All women are afraid of men according to this incel.,asl57x,new,52.0,48.0,48.0,0.0
,“I am a victim of women’s cruelty toward undesirable men.”,asl4uv,new,24.0,40.0,40.0,0.0
,Attractive people don't get insecure,askxoj,new,4.0,7.0,7.0,0.0
,"""A woman is merely a means to create a man.""",asi4df,new,493.0,5838.0,5838.0,0.0
,"If foids can't afford a tampon, just shove a rag up there",ashc4c,new,34.0,47.0,47.0,0.0
,"I sure as fuck am not going to give [my seat] up for a pregnant roastie when I am a kissless virgin. My life is already shit, I'm going to take whatever comforts I can.",asgtqx,new,113.0,182.0,182.0,0.0
,Index fingers are oppressing incels,asfr5o,new,5.0,12.0,12.0,0.0
,Asked why I thought TRP was rapey. Not the answer I expected.,asehk6,new,2.0,10.0,10.0,0.0
,"“Feminism is a terrorist/hate movement against men. Their goal is to send as many totally innocent men as possible to prison for rapes they did not commit.” Feminism is about equality, not setting people up.",asdhda,new,70.0,105.0,105.0,0.0
,What a pity party,asd6os,new,46.0,51.0,51.0,0.0
,"“Most men are incels...” and even “Even IT cucks are incels in denial” No, you are incorrect.",asd2je,new,79.0,153.0,153.0,0.0
,"Apparently Muhammad is an Indian and incel name, even though India is mostly Hindu, not Muslim.",ascna9,new,10.0,31.0,31.0,0.0
,"“Because at the end of the day, men are oppressed”",asbldv,new,64.0,41.0,41.0,0.0
,This absolute sickening thread just shows that incels are more than just women hating virgins. This isn’t even all of it either.,asbhg4,new,110.0,307.0,307.0,0.0
,Take the red pill 💊 and open your third eye. Courtesy of r/MGTOW,as9eus,new,19.0,57.0,57.0,0.0
,"Well if he did some research he'd know that there are plenty of ""chads"" who have gotten ""metooed""",as9c5s,new,34.0,42.0,42.0,0.0
,"""Rape... it's your fault. Esp when you are a child""",as8x40,new,9.0,5.0,5.0,0.0
,"""when did guys butts get so big?""",asa6pb,new,96.0,280.0,280.0,0.0
,"Women are the gatekeepers of sex, until they get pregnant.",as9p3v,new,8.0,9.0,9.0,0.0
,"Let’s hurt myself to make people think I’m cool, yeah that’ll get me all the girls",as9cm3,new,234.0,3108.0,3108.0,0.0
,"Should we tell them, guys?",as95m0,new,243.0,683.0,683.0,0.0
,“They don’t really need to strive for excellence like incels do...” The most inaccurate sentence I’ve heard in quite some time.,as8noi,new,40.0,28.0,28.0,0.0
,Because porn and love are the same thing,as8hn5,new,63.0,157.0,157.0,0.0
,“Women are mostly like children.” A questionable statement by a MGHOW.,as8gr3,new,29.0,23.0,23.0,0.0
,"“Quick, I’m having an online argument and need evidence that a woman can’t love a man the same way a man loves a woman.” hmm",as8c8j,new,86.0,1231.0,1231.0,0.0
,“Are women sociopaths?” Yeah man 50% of the worlds population are sociopaths.,as8aaq,new,15.0,29.0,29.0,0.0
,Found in a Discussion of Reality TV,as809s,new,18.0,60.0,60.0,0.0
,Because female rights are a bad thing,as842d,new,44.0,79.0,79.0,0.0
,We aren’t hateful incels they said....,as7klf,new,39.0,118.0,118.0,0.0
,"Part 2 to my previous post. Final post since I blocked him. Also I was called a libtard, told I needed to be “roughly dominated”, am apparently a midget, and was blamed for an incel’s suicide. Full convo in comments everybody.",as7aa4,new,43.0,46.0,46.0,0.0
,People who defend women are the real rapists,as6spr,new,21.0,15.0,15.0,0.0
,Does this count?,as1zb7,new,12.0,19.0,19.0,0.0
,"""Empathetic"" incel dreams of impregnating villages of the destitute and leaving his army of ""spawn"" behind to die in ""shitty huts"".",as6qpm,new,23.0,22.0,22.0,0.0
,A moment of sanity,as39w5,new,33.0,24.0,24.0,0.0
,"They really like underaged girls, Huh?",as342d,new,20.0,66.0,66.0,0.0
,Posted on r/selfies cause I loved my outfit (stated I’m 16). Received entirely positive feedback except for a DM from somebody I instantly found out was an incel. We’ve been fighting for hours because I’m a petty teenager and I won’t let him have the last word. Whole convo up to now in comments.,as5q84,new,93.0,339.0,339.0,0.0
,This incel doesn’t understand why someone wouldn’t want to have sex with them,as5pht,new,25.0,91.0,91.0,0.0
,"""women care about bone structure. Men care about things women can change about themselves""",as5obu,new,25.0,22.0,22.0,0.0
,"An angry, raging rant that jumps from insulting larger ladies, to annoying show intros, to men that are ""good looking on the eyes""...",as4vcy,new,18.0,17.0,17.0,0.0
,Boomers don't know anything,as40qc,new,30.0,15.0,15.0,0.0
,Guy (red) who concealed his micro penis from his wife until after they were married showing that at least he has a good personality...,as3til,new,9.0,9.0,9.0,0.0
,"""The alpha doesn't love. He doesn't need to display any sort of affection """,as3ktw,new,19.0,35.0,35.0,0.0
,These dumb fucks,as38ze,new,56.0,127.0,127.0,0.0
,Ya all those veteran Suicides and PTSD from sexual abuse sufferers are nothing compared to not getting laid.,as2l8s,new,12.0,13.0,13.0,0.0
,"""the reality of what really happens to ugly men who manage to get a relationship: cuckoldry and deadbedrooms, on a massive scale""",as2gjq,new,19.0,15.0,15.0,0.0
,"Logically unbeatable ""incels are good people"" argument.",as0k7z,new,14.0,26.0,26.0,0.0
,"Incel shares sick fantasy about having a little sister then pivots to only being able to adopt a daughter now, finding a milf with a daughter or raping a ""pro-life bitch"" and then ""I'd blackmail either into sex else I'd torture the other one""",as28ye,new,519.0,5067.0,5067.0,0.0
,Another one that doesn’t understand that there is more than one multi-blade razor brand,arzpjz,new,23.0,43.0,43.0,0.0
,"""I'm not chad but I am still a pretty decent looking guy but without a square jaw, somewhat of a baby face, and a slim frame, and average height. This means I am a low value male""",as26bq,new,9.0,5.0,5.0,0.0
,"""Thousands of years of evolution led to a 6'4"" Chad with blue eyes and blonde hair. What does he end up doing? Having children with a 4'11"" Asian female. Congratulations.""",as0w00,new,34.0,41.0,41.0,0.0
,"""Just go to a swimming pool or the beach and look women faces, you will noticed ur attraction to them goes down pretty immediately and that should be the standard for most of the day""",as0rqm,new,21.0,57.0,57.0,0.0
,"The prophecy of the insects from Saint Elliot, the Purifier --- yes, it is as horrible as it sounds",arzvoa,new,23.0,18.0,18.0,0.0
,Oh Darwincels,arzlz8,new,12.0,12.0,12.0,0.0
,Just calculate,arynev,new,29.0,172.0,172.0,0.0
,"""If short men isn't what women want, then this birth defect needs to be eliminated from the population""",aryfjw,new,219.0,78.0,78.0,0.0
,"""He grapped two poles, stretching out his arms like a T pose, claiming the territory his superior genes deserve.""",ary293,new,74.0,352.0,352.0,0.0
,Women stop maturing mentally during their teens,arxzt0,new,69.0,218.0,218.0,0.0
,"Social anxiety, an incels view",arvro0,new,34.0,34.0,34.0,0.0
,Busted. We're the real rapists here.,aruxgm,new,459.0,4274.0,4274.0,0.0
"There's no strict limit over what types of advice can be sought; it can pertain to general anxiety over virginity, specific romantic situations, or concern that you're drifting toward misogynistic/""black pill"" lines of thought. Please go to /r/SuicideWatch for matters pertaining to suicidal ideation, as we simply can't guarantee that the people here will have sufficient resources to tackle such issues.

As for rules pertaining to the advice givers: all of the sub-wide rules are still in place, but these posts will also place emphasis on avoiding what is often deemed ""normie platitudes."" Essentially, it's something of a nebulous categorization that will ultimately come down to mod discretion, but it should be easy to understand. Simply put, aim for specific and personalized advice. Don't say ""take a shower"" unless someone literally says that they don't shower. Ask ""what kind of exercise do you do?"" instead of just saying ""Go to the gym, bro!""

Furthermore, top-level responses should only be from people seeking advice. Don't just post what you think romantically unsuccessful people, in general, should do. Again, we're going for specific and personalized advice.

*These threads are not a substitute for professional help*. Other's insights may be helpful, but keep in mind that they are not a licensed therapist and do not actually know you. Posts containing obvious trolling or harmful advice will be removed. Use your own discretion for everything else.

Please message the moderators with any questions or concerns.
",Weekly Advice Thread (02/18-02/24),aru57w,new,263.0,19.0,19.0,0.0
,"Incel1: ""Hey, guys. I'm suicidally depressed."" Incel2: ""Lol, I know what'll help. Go fuckin' murder your parents.""",artklk,new,16.0,78.0,78.0,0.0
"(Feel free to delete if this isn't the right place for this.)

Has anyone else noticed that the incel ideology seems to be evolving (Or maybe devolving)? When I first started posting to this sub, their belief system hinged mostly on the desire for sex, period. Over the last 6 months, though, I've noticed that they're less interested in sex and are instead obsessing over purity -- the pedophilia, the virgin obsession, etc. 

The post currently at the top of the sub is a good illustration. That incel could probably have 'ascended,' but he was so wrapped up in the blackpill bullshit that he missed out. Although in this case, I'm glad he ignored her. No one deserves that hateful negativity in their life, especially her kid.

Has anyone else noticed this shift? I'm curious as to what's behind it.",Evolution of incel beliefs,art0yi,new,94.0,288.0,288.0,0.0
,I think I'll have to tell my girlfriend that I'm a celibatary /s,arszhn,new,86.0,210.0,210.0,0.0
,Just wow ...,aros49,new,23.0,50.0,50.0,0.0
,Because women can only have 1 partner in their lifetime,arqv5f,new,35.0,63.0,63.0,0.0
,Incel claims that **10 year old girls** are now sluts and roasties. “Low iq” incel points out that girls aren’t used up until they’re *at least* 14.,arr0bn,new,27.0,171.0,171.0,0.0
,"1 in 400 women have “IQ comparable” to his... in other news, TIL 1 in 400 people have a negative IQ",ars22y,new,197.0,780.0,780.0,0.0
,Incel art,ars5v2,new,164.0,588.0,588.0,0.0
,"Uh, é cruel. Roosh V virou incel",arslk2,new,37.0,28.0,28.0,0.0
,Incel Mentality Fits Collapsed Narcissism Pretty Well,arske2,new,25.0,26.0,26.0,0.0
,"""Some of you A students should drop the fucking books, turn into a C student and just liftmaxx, looksmaxx, gamemaxx, or socialmaxx and try forming decent social bonds that WILL get your farther in life than being a fucking nerd.""",arsaz0,new,51.0,76.0,76.0,0.0
,No happy person has reasons to question this /s,arryyf,new,27.0,81.0,81.0,0.0
,"LMFAO I TRICKED SOMEONE INTO GIVING ME HER PICTURE, BOYOS!",arqdpp,new,27.0,69.0,69.0,0.0
"Okay, this post is going to be long, and it's less mocking more long form talking about a particular issue with a concept incels strongly subscribe to. 

The issue is with numerical rating. He's a 4/10, he's an 8/10, she's a 3/10, she's a 9/10, and the usual. This concept is definitely not exclusive to incels, douchey frat boys and whiny girls use the same vocabulary. I'm discussing it when looking at Incels because they take numerical ratings of people's appearances to the next level. Their concept of a ""looksmatch"" or how people should date those who are as quantitatively attractive as they are is essentially a hyperfixation on this numerical system that society creates and incels hyperfixate on.

Recently, I came across a post on r/ incelswithouthate discussing a new app called Facerate. This app analyzes your face (theoretically focusing on bone structure and symmetry) and assigns a numerical rating. Here is the post for reference.

[https://imgur.com/xjiEjok](https://imgur.com/xjiEjok)

I was curious about this app and tried it out myself. I found some problems with the app, and this led me to consider the incel worldview with a bit less mocking and a bit more debating. 

On the app, I took a picture of myself, and compared it with a friend of mind who I consider to be one of the most attractive men I've ever met. His facerate score was a full point below mine, and I was shocked. I'm not the only person who considers this guy to be extremely attractive, just about everyone in our friend group (around 20 people) thinks he's extremely attractive. 

To preface this, I don't exactly consider myself unattractive. I'm not that old and I've had a few serious and casual relationships to note. I never really had issue finding a girlfriend, and this was despite the fact that I was still in denial about my sexuality and was barely attracted to women in the first place. After coming out as gay, I've still had women strike up flirtatious conversations with me here and there, including a very select few experiences of women offering to ""change my mind."" It's not common, but I don't have incredible or terrible luck at parties and social functions, and I consider myself to be average looking. 

My friend has had about as many relationships as me, but what makes me consider him as incredibly attractive is his ability to make people jealous, and how many people tell his girlfriend that she's very lucky. He gets far more compliments and flirtatious remarks than me at parties and clubs, and he turns heads without much of an issue. I don't like rating people at all, but if someone called him a 10/10, I wouldn't have much of a case to argue. 

When comparing our facerate scores, it was clear how bullshit the app was. The first picture I took of me was on a weekend as I woke up. I hadn't showered, hair was messy, I was half asleep, the picture wasn't good. I took a shower and looked more average as I cleaned up, took another pic, and I improved my score by .5. I got dressed nicer, put on lotion, cologne, and styled my hair and the score went up another .5. 

I don't know how an app that's supposed to be using facial recognition (based on bone structure and the like) would rate me higher based on what I did to look good, but it occured to me I looked much happier and more confident in my second two pictures. It could be that, or it could be that it's a bad app, and that even computers, which are really good at attaching numbers to seemingly innocuous data, can't put a number on the looks of a person. 

Anyway, this got me thinking about how we perceive attractiveness in general. The incels do have a point. There are a lot of people invested in a visual aesthetic and who date purely based on looks. I know several people like that. Personality alone isn't enough to establish a relationship, there has to be a base level of physical attraction. It would be like trying to force me, a gay man, into a relationship with a woman. One of my ex-girlfriends is a good friend of mine and I enjoy talking to her, she has a wonderful personality. I wouldn't date her though, because I don't find her attractive in the way that's needed to facilitate a romantic relationship. 

However, many people like to focus on the fact that Incels are very hung up on their looks. I've been to incel forums, they normally don't look half bad. I agree with this, Incels focus too much on how they look and not enough on personality. Like it or not, Incels didn't come up with numerical rating of a person's looks. That was our society as a whole. Our damned president tweets about it, it's not an uncommon societal trend. When someone is rejected by people enough it makes sense that they would focus on their looks, something that is genetic and hard to alter. 

The reality of the situation is that there are people who consider themselves attractive filter out those who aren't attractive and date purely because of sex appeal. This superiority complex leads people to think of themselves in higher leagues than others, as with the commonly used ""He/She's out of your league."" phrase goes. People tend to be attracted to attractive people, and if someone sees another person as below their league, they would probably reject them because that sort of ideology promotes a superiority complex. 

Incels take this belief to the extreme. The fact that women don't respond to their advances is crushing to them, and understandably so. Among individuals who are already socially awkward and depressed, this lack of companionship hurts. From this rejection and depression, a hatred of women in general forms, to try and explain why none of the women in their ""sample size"" responded to their advances. Incels then come to the conclusion that women are soulless beings devoid of any emotion but lust. This belief, obviously, is quite idiotic. The fact that it is formed from a genuine sadness and depression though, makes it much more difficult to see the many glaring flaws in the incel worldview. This depression gives way to more and more radical beliefs about women being subhuman and terrible crimes being morally justifiable, and eventually ends in wallowing in depression (or worse) and getting stuck at the bottom of a destructive downward spiral. 

Now naturally, there are quite a few people who handle dating like an exhibition. These people are likely who the incels have experiences with and then, subsequently, get rejected and drop out of the search altogether. In reality, there are a lot of people who want to seek a relationship with someone based on mutual chemistry and genuine human love. Incels write this off as a fantasy because of their bad experiences, and the subsequent rationalization of those experiences. It's common practice to dismiss incels as terrible human beings. There is some legitimacy to this. Incels say and sometimes do awful things. It is important though, to see them as human beings with genuine emotional issues. It's entirely probable that their earlier experiences with women and dating were not positive because they weren't treated right. It doesn't justify their actions, or the idea that they should give up on themselves, life and dating because of a few bad experiences, but it is important to see that they are catastrophizing and jumping to irrational conclusions based on a genuine emotional struggle. 

Circling back to the idea of attraction and assigning a numerical value to it, incels, and many people in general, ignore the personality aspect of it. I think back to the friend I compared myself with on Facerate. He's amazing looking, but he's also hilarious and fun to be around. His smile is contagious and he's a genuinely kind person. Sometimes an asshole is seen as attractive, but not really by the type of people who are worth pursuing in long term relationships. When someone has a good personality they seem more attractive, especially if their personality is compatible with yours, be it platonically or romantically. Attraction is based on more than looks, and looks become more attractive when complimented by a great state of mind. 

Honestly, Incels and the concept of a ""looksmatch"" is a product of a culture that focuses too much on aesthetic. This culture definitely doesn't affect everyone the same way, given that not everyone who has bad luck dating ends up an incel and not everyone who looks really good develops an arrogance about their looks. I don't like to sympathize with Incels, and I definitely don't excuse their behavior. That being said, I do reluctantly feel compassionate towards their difficulty with relationships, especially because there is a lot of people who act as if just improving their personality is enough to fix their problems. A portion of the problem can be associated with a culture that already rates people based on physical attraction, and Incels suffer for it. The situation is bad, and the reaction is worse. Ultimately, I think joking about Incels and their insane worldview is necessary. It helps prevent more people from falling into it; But I also think that it's important to acknowledge the emotional problems of those behind the computer screens. They need to take responsibility for their actions, but as all humans do, they deserve some level of compassion.   


TL;DR, Oftentimes, Incels focus on a numerical value of looks (He's a 9/10, she's a 4/10, etc.) which is already created by society, and they overreact to it because of depression over reaction. Attraction is far more complex than numbers can assign, and Incels aren't exempt from taking responsibility for the venom they spew on a daily basis, but it is also important to recognize that they are still humans that are screwed over by a shitty situation and that deserves a certain extent of compassion. (And making sure that my point is clear, don't feel bad for mocking the dumb ideas that Incels spread. The less people who fall into it the better. Just don't target people.) ","Incels, bone structure, and the problem with numerical ratings",arq1o2,new,7.0,9.0,9.0,0.0
,Incels casually celebrating that female suicide rate is rising,aro443,new,37.0,47.0,47.0,0.0
,Have these “men going their own way” ever even met a woman?,arodx4,new,40.0,33.0,33.0,0.0
,Oh what you don't have funny sex stories you tell all the time??,arppcz,new,355.0,1988.0,1988.0,0.0
,Só que não,arp4lm,new,117.0,259.0,259.0,0.0
,"""It's entirely in someone's right to judge someone for degenerate behaviour...""",aromag,new,41.0,41.0,41.0,0.0
,"Incels discuss ways to get the ""high score"" while referencing Elliot Rodgers, mocking inceltears and claiming chads are more violent",arnw01,new,18.0,23.0,23.0,0.0
,No self awareness (nothing unusual),arjip9,new,6.0,17.0,17.0,0.0
,"I asked r/braincels what they think of this video, what do you guys think of it?",arkv4w,new,18.0,23.0,23.0,0.0
,"Not gonna lie, this was pretty funny to read",arlq0c,new,20.0,48.0,48.0,0.0
,"I saw three ""just rope it's pointless"" comments as soon as I scrolled down, but it's ok because they're a support group.",arm0ki,new,16.0,29.0,29.0,0.0
,A bunch of ephebophiles and pedophiles.,arnbyn,new,136.0,322.0,322.0,0.0
,From the brand spankin' new InSubs: Complete Isolation is an absolute necessity in order to keep the female subservient and attracted to her husband.,arngf4,new,19.0,36.0,36.0,0.0
