selftext,title,id,sorted_by,num_comments,score,ups,downs
"There's no strict limit over what types of advice can be sought; it can pertain to general anxiety over virginity, specific romantic situations, or concern that you're drifting toward misogynistic/""black pill"" lines of thought. Please go to /r/SuicideWatch for matters pertaining to suicidal ideation, as we simply can't guarantee that the people here will have sufficient resources to tackle such issues.

As for rules pertaining to the advice givers: all of the sub-wide rules are still in place, but these posts will also place emphasis on avoiding what is often deemed ""normie platitudes."" Essentially, it's something of a nebulous categorization that will ultimately come down to mod discretion, but it should be easy to understand. Simply put, aim for specific and personalized advice. Don't say ""take a shower"" unless someone literally says that they don't shower. Ask ""what kind of exercise do you do?"" instead of just saying ""Go to the gym, bro!""

Furthermore, top-level responses should only be from people seeking advice. Don't just post what you think romantically unsuccessful people, in general, should do. Again, we're going for specific and personalized advice.

*These threads are not a substitute for professional help*. Other's insights may be helpful, but keep in mind that they are not a licensed therapist and do not actually know you. Posts containing obvious trolling or harmful advice will be removed. Use your own discretion for everything else.

Please message the moderators with any questions or concerns.
",Weekly Advice Thread (02/04-02/10),amyvbf,new,703.0,38.0,38.0,0.0
,Braincels “Foids are so shallow that they think TED BUNDY is hot.” Also braincels “LOOK AT HIS SCULPTED FACE WHAT A SPECIMEN WOW”,amyakm,new,103.0,157.0,157.0,0.0
,"Not getting laid causes PTSD, and other observations.",ams6xn,new,16.0,16.0,16.0,0.0
,Someone actually made this,amuij7,new,13.0,28.0,28.0,0.0
,It appears we’ve rustled somebody’s feathers.,amvh69,new,37.0,60.0,60.0,0.0
,Annnnndddd they think a fake tweet is real yet again,amvncj,new,7.0,35.0,35.0,0.0
,The Mariana’s Trench Of The Virgin/Whore Complex,amxcki,new,51.0,324.0,324.0,0.0
,Incel with his revolutionary innovative idea: censitary suffrage,amx4jf,new,12.0,24.0,24.0,0.0
,Incels rage at the idea of treating women like human beings,amwjnx,new,30.0,59.0,59.0,0.0
,"Incel says women don't have the mental capacity to vote, but still wants to have sex with them",amvezh,new,68.0,141.0,141.0,0.0
,"Incels live in a world of constant war, rape and pillage",amvbzp,new,28.0,30.0,30.0,0.0
,"Incel thinks woman owe them sex so they can be ""cured""",amutl7,new,9.0,26.0,26.0,0.0
,"Oh, how smart /s",amucfp,new,29.0,109.0,109.0,0.0
,TIL short people are not normal,amtvbq,new,27.0,27.0,27.0,0.0
,Incel: Refuges coming to take our women!!!!,amtig1,new,39.0,105.0,105.0,0.0
,Poor guys,amsogl,new,92.0,74.0,74.0,0.0
,"MGTOWs mock a devoted single father--who lost the mothers of his 2 children to tragic, untimely deaths-- calling him stupid and stating that he was lucky they died.",amsevd,new,112.0,325.0,325.0,0.0
,"""As you can see from the title I would refer to myself as a Chad."" hilariously grandiose LARPing",ams75u,new,17.0,19.0,19.0,0.0
,"Fun, energizing",ams75j,new,37.0,36.0,36.0,0.0
,Because acting like a spoiled brat definitely helps,amrm58,new,8.0,31.0,31.0,0.0
,I wonder why women don't like him,amrmof,new,32.0,217.0,217.0,0.0
,No comment,ams4zj,new,11.0,14.0,14.0,0.0
,Yes. It's your shit personality,ams143,new,18.0,66.0,66.0,0.0
,Found this gem on whisper,ams08d,new,10.0,32.0,32.0,0.0
,HAHAHAH they have no fucking idea how it even works down there!,amrgc3,new,52.0,258.0,258.0,0.0
,"The reality is that in promiscuous culture, a small percentage of men can monopolize sex with a majority of women.",amrdjp,new,32.0,6.0,6.0,0.0
,"""foids are supersticious"" so screw with their heads if they reject you by wishing cancer on them",amrcfr,new,11.0,56.0,56.0,0.0
,A revealing look at how an incel thinks the life of a hot girl is...,amraxd,new,42.0,106.0,106.0,0.0
,Incel gets dropped by a girl he tried to intimidate. Continued,amraeb,new,143.0,176.0,176.0,0.0
,"In other words, full grown men not only refuse to take responsibilty for their actions because ""reasons"" but project that mindset onto every other man.",amr423,new,9.0,20.0,20.0,0.0
,On a post about how the normies definition of incels is all wrong. The irony physically hurts me lol.,amq1w8,new,13.0,31.0,31.0,0.0
,This girl didn't put forth any effort to date the guy she liked.,ampsoy,new,11.0,23.0,23.0,0.0
,why do girls hate incels so much??????????? it's just because we're ugly huh,ampmyk,new,12.0,34.0,34.0,0.0
,Incel gets dropped by a girl he tried to intimidate. Lol,amr7h5,new,18.0,117.0,117.0,0.0
,A prime example that their personalities are definitely not the problem...,amr2ad,new,47.0,538.0,538.0,0.0
,"Incel reading about species that ""are more civilized than we could ever dream of being""",amqvy1,new,10.0,45.0,45.0,0.0
,Oh wow.,ampl0o,new,48.0,245.0,245.0,0.0
,"MGTOW: ""I hate how superficial and shallow women are!"" Also MGTOW:",ampimr,new,41.0,118.0,118.0,0.0
,It’s simple science...,amp303,new,576.0,12655.0,12655.0,0.0
,You need an emotional support animal,amot1n,new,7.0,19.0,19.0,0.0
,Ahhh yes. An Incel's wet dream: an theocratic dictatorship that treats women like objects.,amokz2,new,15.0,22.0,22.0,0.0
,How beauty you are can determine what jobs you can have,amoadm,new,5.0,3.0,3.0,0.0
,"""even normies who get girls are just guys that women are settling for. Women give away the best of their youth and sexuality to the highest of the high genetic quality specimen that she can bag""",amq0do,new,17.0,23.0,23.0,0.0
,"MGTOWs think scientific advances in birthing technology will render women obsolete, and ultimately lead to their extinction.",amotka,new,115.0,411.0,411.0,0.0
,I think this guy is onto something /s,amnmpv,new,15.0,18.0,18.0,0.0
,Social homeostasis,ammt1h,new,9.0,219.0,219.0,0.0
,Not even handshakes are safe.,ammcnz,new,9.0,13.0,13.0,0.0
,"Just your daily racist post from r/Braincels, instant facepalm cringe guaranteed",amlcla,new,20.0,44.0,44.0,0.0
,How dare selfish femoids show gratitude?!,amkoio,new,10.0,62.0,62.0,0.0
,"Femcel is ""absolutely haunted"" at ugly men having girlfriends",amk04n,new,10.0,31.0,31.0,0.0
,Apparently I'm not a man for being pro lgbt (he attacked me on lgbt sub after posting to IT about an incel subreddit ban),amjzk8,new,1.0,16.0,16.0,0.0
,Should I post this to MGTOW and get banned?,amj61q,new,15.0,97.0,97.0,0.0
,Men going their own way by going out of their way to insult women.,amizy4,new,10.0,21.0,21.0,0.0
,How do they not realise how hypocritical and backwards their thinking is?,amihe1,new,8.0,10.0,10.0,0.0
,Found on r/dayton,ami7e8,new,7.0,17.0,17.0,0.0
,Got banned from MGTOW for trying to have a discussion. Here’s a snippet of what happened.,amh5xp,new,6.0,31.0,31.0,0.0
,I love pwning incels. They jump to their own defense so fast. I'm sorry I couldnt give you what they actually said as I was banned from the sub within 15 minutes.,amgzw2,new,3.0,8.0,8.0,0.0
"&#x200B;

https://i.redd.it/l6fb3e5e67e21.png",Abhorrent.,amgrje,new,2.0,11.0,11.0,0.0
,Hilarious how they actually view themselves as people who’d kick ass in an apocalyptic setting,amgcrr,new,21.0,16.0,16.0,0.0
,They absolutely cannot grasp the concept of body autonomy,ammynn,new,74.0,365.0,365.0,0.0
,"Females of IncelTears... Can you confirm you are ""literally doing something sexual"" every minute?",amm2ex,new,75.0,92.0,92.0,0.0
,Incel DM Poetry,amlyga,new,33.0,28.0,28.0,0.0
,""" I can no longer do basic fucking calculus[because I don't get laid]""",amkmea,new,21.0,46.0,46.0,0.0
,Looooooollllllzzzz I don't even do this when I see a hot guy,amjk86,new,463.0,6082.0,6082.0,0.0
,Truth will destroy society,amjgpp,new,16.0,81.0,81.0,0.0
,Dude! Wut? This better be a troll,amjgga,new,31.0,172.0,172.0,0.0
,"Incel declares since he'll never get sex he is off to bash on unwed mothers online. And, oh yeah... Fuck IncelTears also",amjbsg,new,55.0,149.0,149.0,0.0
,"""We are old already 25+, you've essentially lived half of your active life""",amih6t,new,46.0,30.0,30.0,0.0
,"PSA to Incels: The answer to any question that starts ""Is it rape if..."" is yes. Always YES.",ami1zt,new,113.0,1727.0,1727.0,0.0
,I honestly don't understand how you can be this insecure. Like Jesus! Y'all life must suck homie,amhxab,new,30.0,73.0,73.0,0.0
,Incel who claims to br studying medicine and his ideas about euthanasia,amhrki,new,20.0,43.0,43.0,0.0
,Incel Hatches Brilliant Plan to Guilt Trip a Black Girl Into Dating Him By Saying She's Racist if She Refuses,amhei7,new,60.0,333.0,333.0,0.0
,How obsessed,amhduu,new,56.0,260.0,260.0,0.0
,"""The blackpill is about accepting there is no universal justice, fairness or comeback""",amgvfc,new,14.0,19.0,19.0,0.0
,"Women stay in bad relationships due to economic struggles. Of course, incels see something totally different.",amgs2n,new,24.0,67.0,67.0,0.0
,Projection,amgqyh,new,17.0,94.0,94.0,0.0
,How civilized/s,amgmes,new,91.0,1769.0,1769.0,0.0
,This comment on this article...,amg1k5,new,80.0,1407.0,1407.0,0.0
,"""Obviously if you are schizophrenic or bipolar this shit doesn't apply but for regular guys living in a fucked up situation therapy will be worthless.""",amfn26,new,23.0,59.0,59.0,0.0
,Violent misogyny and homophobia all in one post. How nice,amc09v,new,12.0,58.0,58.0,0.0
,If your a virgin you are a “nice guy” or a nazi...,amf595,new,26.0,144.0,144.0,0.0
,I think this belongs here,amekua,new,11.0,180.0,180.0,0.0
,"""When forced to do something girls will learn to accept and appreciate it""",ame7l5,new,38.0,132.0,132.0,0.0
,The best cope for for those sensitive incels,amd80s,new,2.0,41.0,41.0,0.0
,The end to the saga of The Obsessed Incel and The Confused/Annoyed Chad.........or is it?,amd9n5,new,4.0,11.0,11.0,0.0
,Ah so THAT’S who my secret admirer is! The Mystery of The Incel and His Lust For Chad is solved now,amd7sd,new,2.0,6.0,6.0,0.0
,"Look I know you guys want me, but I reiterate, I’m not interested in you",amd659,new,2.0,6.0,6.0,0.0
,"I should probably tell them I’m not gay, it’ll break their hearts",amd2gx,new,1.0,8.0,8.0,0.0
,Just casual incel propaganda on the front page of /r/dankmemes,amcs2h,new,10.0,45.0,45.0,0.0
,Idk if this has been done before but,amdurn,new,419.0,6140.0,6140.0,0.0
,[NSFW] I don’t think I’ve ever hoped more that they’re just role playing,amchdm,new,12.0,33.0,33.0,0.0
,MGTOW - “We don’t mindlessly hate on women. There are deep reasons at play here why we have to continue warning men about women and how they are ruining society”.Also MGTOW -,ambztu,new,7.0,30.0,30.0,0.0
,""" Entire races of men as old as time such as curries or the japanese literally go sexless and alone for their whole lives because the foids decide who they want and they don't want curry when they can have chad""",amfbla,new,28.0,61.0,61.0,0.0
,"""why do people post pictures of themselves? R: Because their brains are fucked""",amf73p,new,10.0,38.0,38.0,0.0
,"""girls would be a lot more stable and happy with a guy who controls them, without it they are like toddlers without parents.""",ameyqe,new,43.0,244.0,244.0,0.0
,"""No woman faces adversity.""",amc07u,new,57.0,126.0,126.0,0.0
,Incels want sympathy while giving hate at the same time!,ambi1v,new,151.0,785.0,785.0,0.0
,"One Incel desides to stalk me, one thinks I’m from a single mother home and one literally asked me for child porn",ambbiy,new,77.0,74.0,74.0,0.0
"&#x200B;

https://i.redd.it/4xdmg4u473e21.png","""Galatians 3:28 - After women start WW3 they are going to nuke themselves""",amayst,new,15.0,33.0,33.0,0.0
,Is Birdo the new Incel icon?,am9ppp,new,9.0,23.0,23.0,0.0
,Great podcast about Incels today on Stuff They Don’t Want You to Know.,am9nl4,new,5.0,27.0,27.0,0.0
,“IT LOVES to brand us all as toxic and bigoted! We’re actually more open and accepting than all of reddit!”,am891w,new,28.0,42.0,42.0,0.0
,The Incel of Antiquity,am88q5,new,24.0,46.0,46.0,0.0
,"True top mind over here, folks.",am7til,new,5.0,25.0,25.0,0.0
,"Everything I say is a lie, apparently.",am7ogw,new,17.0,50.0,50.0,0.0
,"“I 100% get why they love men who are aggressive, dominant, rapists and even murderers”. What in the world",am7l0e,new,7.0,12.0,12.0,0.0
,"“All women are prostitutes in some way, shape or form”",am7kd3,new,3.0,15.0,15.0,0.0
,Height determines your worth. (Also posted on r/niceguys),am7ifv,new,26.0,45.0,45.0,0.0
,from 0 to 100 real quick,am7e43,new,1.0,34.0,34.0,0.0
,"This meme sums up the ""Thot Audit"" perfectly.",am6bsp,new,14.0,26.0,26.0,0.0
,""" Women don't ever talk about jaws, eye shape, cheekbones, or facial tilt. They just use the word ""cute"" in order to keep the blackpill away from men.""",amargq,new,18.0,40.0,40.0,0.0
,What was he even trying to say?,am9wi1,new,13.0,30.0,30.0,0.0
,"Feliz aniversário, envelheço na cidade",am8g05,new,35.0,95.0,95.0,0.0
,I thought I'd never see the day,am7fc5,new,885.0,18332.0,18332.0,0.0
,"yep, this but unironically",am4emf,new,65.0,81.0,81.0,0.0
,"""a young incel who is working at a company needs a sexual relationship with a girlfriend as part of his career development""",am4yg1,new,56.0,97.0,97.0,0.0
,Cross post from not how girls work,am3wl5,new,94.0,203.0,203.0,0.0
,Why Is it socially unacceptable for me to punch women who refuse to sleep with me😂🤦,am3izf,new,152.0,650.0,650.0,0.0
,Femoid voices are so bad!,am2ga9,new,21.0,45.0,45.0,0.0
,"Oooo, my first dm!",am24ib,new,23.0,58.0,58.0,0.0
,12yo having sex,am1cdn,new,24.0,71.0,71.0,0.0
,"""femoids are ignorant, stupid, low IQ, destructive, selfish, narrow-minded, narcissistic, insane, retarded beings. So the more they get power, the more problems will be created""",am2lmy,new,19.0,52.0,52.0,0.0
,"""Ah, the good ol' days-- when women had no rights and men were allowed to assault their girlfriends and wives""",am2j2z,new,68.0,197.0,197.0,0.0
,"""We go to the doctor (at least in europe, rip americancels) for the smallest pain, in order to prevent more damages. BUT if you do not experience sex and the warm touch of a female hugging you, for FUCKING YEARS or AN ENTIRE LIFE, then you deserve nothing.""",am1zqy,new,25.0,35.0,35.0,0.0
,"""The Soy Industry shut down the 'soy lowers testosterone' argument for the general population so hard that almost every idiot will say Soy is good for you.""",am1x83,new,40.0,39.0,39.0,0.0
,"oh, incel sociology",am1pq6,new,8.0,26.0,26.0,0.0
,B A D B O Y S,am0qrz,new,34.0,32.0,32.0,0.0
,From incels.is. propaganda promoting pedophilia with bad grammar,am0ikt,new,119.0,137.0,137.0,0.0
,Imagine being this angry.,am00yr,new,245.0,274.0,274.0,0.0
,Tried to see if I could find anything wholesome in MGTOW. Found one but top comments are toxic as ever. Can’t they just be happy for someone?,alzvsx,new,12.0,20.0,20.0,0.0
,Man the r/MGTOW page is toxic,alyw87,new,95.0,132.0,132.0,0.0
,“Leave it to incels to find a wrong reason to hate Ted Bundy”,alyz4u,new,374.0,11246.0,11246.0,0.0
,"That whole fanfic only to keep saying ""at least U keep my dignity, unlike men who support feminism""",alycoq,new,45.0,103.0,103.0,0.0
,A man going his own way gets angry when I called him an incel... then proceeded to devolve into typical incel behavior.,alxfsd,new,75.0,232.0,232.0,0.0
,His whole post history is filled with this type of stuff,alxl3y,new,51.0,65.0,65.0,0.0
"Disclaimer: I meant to say ""Many killers like...."" . Im sorry I misused the word terrorist.  Also, I did bring up the Las Vegas shooter and the Texas Church shooter, but the screenshots were too long.

https://i.redd.it/vieh9xkoivd21.png",How dare most mass shooters NOT be incels?,alxmh2,new,5.0,12.0,12.0,0.0
,Person brings your lazy ass food. Doesn't tip because they are a woman.,alwt8n,new,66.0,513.0,513.0,0.0
,"Long time inceltears reader, first time contributor. One of my high school friends shared a post on Facebook about how women never “ask” to be raped just because of what clothes they’re wearing. Serious mommy issues with this one...",aluwr9,new,8.0,33.0,33.0,0.0
,A genuinely heartbreaking post from Braincels,alsalu,new,19.0,42.0,42.0,0.0
,This is a poll posted on r/braincels asking about the members' age. It's sad to see people so young give up on love life at such a young age. I'm 17. I'm a virgin. Never been in a relationship. But at least I still have hope.,alsj50,new,24.0,56.0,56.0,0.0
,Dude what,alvme0,new,10.0,51.0,51.0,0.0
,Incels love thinking they are experts in Evolution,alw07j,new,9.0,34.0,34.0,0.0
,""" Women can freely indulge in their sexual urges and fuck Chads all day long without having to worry about pregnancy. This is the root cause of all the misery we see nowaday""",alv4uz,new,59.0,46.0,46.0,0.0
,I find it unfair that us men have better skin and yet we are constantly seen as ugly even though our looks match is probably fucking men above her looks level.,aluxt3,new,34.0,28.0,28.0,0.0
,Plot twist: the right picture looks like Brazilian Transwoman singer Pablo Vittar (i.redd.it),aluu5k,new,27.0,68.0,68.0,0.0
,Illustrated version of a copypasta,aluojy,new,103.0,132.0,132.0,0.0
,If the sex you have is less enthusiastic than staged porn...,alugio,new,20.0,74.0,74.0,0.0
,On a post with a girl and a dog looking happy together. Apparently that means they fucked and ALSO that all girls aged 18 have fucked multiple dogs.,alsx0w,new,13.0,21.0,21.0,0.0
,"humans have selfish reasons to want subhumans to exist, so the cardinal subhuman right of euthanasia isn't upheld.",alswvo,new,8.0,24.0,24.0,0.0
,"""it's easier to deal with the life of a single, especially when you see the life of betabux-friends""",alsu5n,new,13.0,18.0,18.0,0.0
,"'Waaah, it's society's fault I'm incel!' The whole thread is full of incels and people who think they should be given girlfriends. I called them out and got downvoted to oblivion. These people don't overlook the misogyny and the violence -- they blame it on women.",alsbvh,new,58.0,45.0,45.0,0.0
,Incels watching too much beastiality porn.,alre11,new,49.0,193.0,193.0,0.0
,Found one in YouTube. Women = Psychopaths. Psychopaths are just feminine its seems...,alr6xm,new,12.0,26.0,26.0,0.0
,"""These ""clichees"" (sic) are on Tinder and other dating websites. That's how we know women.""",alqxa2,new,3.0,14.0,14.0,0.0
,The old switcheroo,alqvs2,new,6.0,19.0,19.0,0.0
,They really have no idea how any of this works do they?,alpqc9,new,8.0,23.0,23.0,0.0
,See title...,alphlm,new,8.0,19.0,19.0,0.0
,"If you feel angry or depressed because of that folder, seek professional help ASAP",alr6wo,new,48.0,298.0,298.0,0.0
,"[red pill] ""Sex used to be a huge practical and emotional decision, on the level of buying a house. Now, it is more like choosing which restaurant to eat dinner at""",alr1sm,new,7.0,22.0,22.0,0.0
,"""You won't find an attractive, happy or successful person on IT""",alqgd8,new,115.0,100.0,100.0,0.0
,It's over for Steinbeckcels,alqfhl,new,18.0,37.0,37.0,0.0
,"""They love all degrading weird shit with chad, but actually she doesnt find it degrading, she needs it to feel like feminine. Anal, doggy, blowjobs, facefucking, deepthroat, spanking, ropes, 50 shades of grey, swallowing, etc. She voluntary wants this because its submisive""",alq6lt,new,40.0,36.0,36.0,0.0
,This just in: Incels mad that Indian celebrity Aziz Ansari dares to live a happy life rather than being a black-pill ambassador for their bucket of crabs.,alpltp,new,791.0,6635.0,6635.0,0.0
,Happiness level 100%,alp9de,new,28.0,58.0,58.0,0.0
,I feel sad for this kid. He’s clearly not an incel and shouldn’t associate with them. He needs to get out of that sub before he gets brainwashed.,aloxg1,new,153.0,488.0,488.0,0.0
https://www.google.co.uk/amp/s/metro.co.uk/2019/01/30/students-suspended-saying-fun-rape-100-girls-allowed-back-uni-8417344/amp/,The Incels are at it again,alnsa2,new,4.0,11.0,11.0,0.0
,It's so easy finding content for this sub,alnh1x,new,59.0,534.0,534.0,0.0
,"Seriously, why does it always have to be the Jews? Haven't those guys heard of the Illuminati? Or Chaos?",alnnvl,new,57.0,172.0,172.0,0.0
,Incels: *destroyed*,alnao0,new,7.0,34.0,34.0,0.0
,"Not sure if ive just been wooshed, or if i caught one in the wild.",aln0h6,new,38.0,375.0,375.0,0.0
,Incels Still Want My Attention And One Thinks I’d Love Him🤢🤮,almk5g,new,44.0,33.0,33.0,0.0
,"Asking a ""femoid"" out == sexual harrasment",almxnh,new,27.0,38.0,38.0,0.0
,"""You estrogen-infused pussies may think you and your SOs are basically the same except for your sex parts, because you're feminized nu males whose low testosterone levels reflect a general trend in the male population that concerns doctors everywhere.""",allnqm,new,32.0,54.0,54.0,0.0
,"""The UN is stealing money from money in order to help these muslim sluts cuck middle-eastern men.""",aljt4p,new,10.0,19.0,19.0,0.0
,What is your opinion on the sub reddit ‘incels without hate’?,alikqq,new,26.0,11.0,11.0,0.0
,DON'T. Run in the opposite direction,aljp3u,new,57.0,287.0,287.0,0.0
,Just change your diet because of pseudoscience bro,alihse,new,67.0,74.0,74.0,0.0
"i sincerely hope it is, any ideology like that does not deserve any sort of congregation. i know that inceldom is not a religion but it actually seems like a fucking cult amirite? ",is incels.is shut down?,alfhli,new,45.0,29.0,29.0,0.0
,Woman wears a dress to the Opera. Its practically the Apocalypse to the Incels.,algame,new,19.0,28.0,28.0,0.0
,"mildly fucking disturbing, not gonna lie",alhng6,new,17.0,55.0,55.0,0.0
,Fiscais de punheta(masturbation inspectors),alhmsi,new,2.0,18.0,18.0,0.0
"&#x200B;

https://i.redd.it/wj07xzhl7md21.png","Don't have long hair, girls",algnxm,new,104.0,264.0,264.0,0.0
,My dads a chad and the government created aids,alhe4w,new,27.0,50.0,50.0,0.0
,""" Anyone else have random strangers walk up to you and start talking about very specific incel related topics? The government must think I'm Eunus but I'm not really a threat because I plan on offing myself soon anyway.""",alfthd,new,20.0,36.0,36.0,0.0
,"""She will never desire sex from you, it will only be something she has to do in order to keep you working.""",alfgpr,new,44.0,45.0,45.0,0.0
,Word salad+projection+crazy theory=,alfeh0,new,16.0,24.0,24.0,0.0
,I was talking to this foid coworker during a break at work ... I felt like a 20th century British psychologist observing the primitive behaviors of a Vanuatu bushman,alew2s,new,46.0,118.0,118.0,0.0
,🤔🤔,aleqww,new,398.0,9118.0,9118.0,0.0
,I wasn't sure where to post this... But I'm 99.9% sure he's Incelimus Prime.,aleoom,new,146.0,189.0,189.0,0.0
,There are so many things wrong with this.,ale5ve,new,69.0,40.0,40.0,0.0
,Found of of the really toxic ones and clicked on his profile. This was rhe firat image to pop up. I almost died laughing.,ald74f,new,33.0,90.0,90.0,0.0
,I don’t think he gets it,ald04x,new,26.0,151.0,151.0,0.0
,Race mixing is degenerate and multiculturalism creates incels.,albcdg,new,153.0,396.0,396.0,0.0
,“Every single girl with the left face masturbates to lesbian porn. It’s the lesbian face.”,ala069,new,87.0,345.0,345.0,0.0
,I took a trip into their echo chamber and found this gem,al9ws8,new,95.0,469.0,469.0,0.0
,Where are we gonna get content now? ( shout out the guy who told me my ip was in the picture in my last post ),al9pv9,new,10.0,70.0,70.0,0.0
,I’m barely surprised but I still have no words.,al5q1j,new,16.0,48.0,48.0,0.0
,"The /r/fatpeoplehate offshoot /r/choosingbeggars drifted away from insulting people not up to their standards (especially fat women and single mothers) for daring having any standards, the real reason why for Incels? Hiding the Black Pill!",al2tim,new,10.0,22.0,22.0,0.0
,My prediction about Incels becoming shitty dystopian writers proved itself to be true.,al2peh,new,9.0,23.0,23.0,0.0
,We’re reaching new levels of desperation here.,al6xc6,new,22.0,60.0,60.0,0.0
,"I hit ""the wall"" last year and honestly couldn't be more relieved",al796o,new,22.0,62.0,62.0,0.0
,"Nothing cleared up, pedo incel is still pedo.",al9egd,new,112.0,687.0,687.0,0.0
,Incel meme states that basic decent behavior should be rewarded with sex. Also girls fantasize about serial killers?,al9ju3,new,40.0,126.0,126.0,0.0
,[Women are] not the same as men. Not even close. These people are not my species. I don't relate to any of them.,al7v7t,new,25.0,44.0,44.0,0.0
,"""Oh me, oh my, oh dear.""",al7hcw,new,18.0,58.0,58.0,0.0
,"""normies are incels"" #wtf ?",al6z9r,new,44.0,41.0,41.0,0.0
,We here at /inceltears do not condone making fun of incels...,al6rlk,new,139.0,3707.0,3707.0,0.0
,Yeah like us normal people are as easily brainwashed as incels. 🙄,al67og,new,31.0,166.0,166.0,0.0
,"Incel trifecta: Racism, Misogyny and Rape all in one post",al5xa4,new,40.0,258.0,258.0,0.0
,"""All women are another species--they are not fully human"" uhh, I'm gonna need some sources on that.",al4qp9,new,80.0,157.0,157.0,0.0
,"When your ""girl"" is actually your hand, you never have to deal with backtalk.",al4max,new,267.0,2888.0,2888.0,0.0
,Not gonna lie you had me in the first half....,al3i4s,new,20.0,37.0,37.0,0.0
,"""Women-men friendship does not exist""",al43og,new,44.0,92.0,92.0,0.0
,I...I can't tell if this dude is trolling or is being serious.,al3l6x,new,37.0,130.0,130.0,0.0
,It's over for Misescels,al3joq,new,18.0,19.0,19.0,0.0
,"""people would use the blackpill against us. Tyrone's would justify stealing from us cause we're incels at the same time as SJW's would justify castrating us because we genetically inferior""",al3h4j,new,14.0,25.0,25.0,0.0
,"'Don’t let people lie to you, being short is the absolute, 100%, without a shadow of a doubt worse thing a man can be.""",al3dym,new,36.0,31.0,31.0,0.0
,I mean it makes sense. They are easily brainwashed,al3a2v,new,25.0,162.0,162.0,0.0
