selftext,title,id,sorted_by,num_comments,score,ups,downs
" I’ve considered myself an incel for the past few years. Today, I realized something which may make change my mind about how I view myself and this « incel » label I applied to me. 

I’m not happy with my life. That’s what I’m telling myself on a regular basis. I have no friends, no girlfriend, no social or romantic/sexual life whatsoever.   
 I spend all my time at home indulging in perverted addictions like porn, play video games non stop and eating waaaay too much. I make no effort to improve myself or to improve anything because it’s not worth it, it won’t work, I’m a genetic failure and thus it’s useless to try to battle this fate of mine that my life will suck whatever I do. Even if I improve as much as I can, nothing will change because of my poor genetics that are a limiting factor. 

It’s not my fault. It’s the universe’s. I was born flawed, ugly and a pathetic loser and there is nothing I can do that can change my fate. 

So why bother trying ?

Today I realized one thing. I realized why I adopted this incel mindset and identity. The reason why is because it allows me to do two things : 1) whine, throw self pity-parties, take up a victim mentality and 2) fuel my hatred of all humans and particularly women. 

Something happened in my life in 2013/ 2014. I was destroyed by my then girlfriend who, even by « normies » and mainstream standards was a fucking toxic person. She stole my semen, tried to get pregnant, cheated on me with 4 guys and 6 women in 3 months, cut me from my family, friends, hobbies, mentally abused me. I got out quickly but broken. I then started to 1) hate women, 2) never want to have any interaction of any kind with any woman to protect myself. 

That’s where my hatred of women comes from. I was also betrayed by my friends at the same time. That’s where my hatred for humans comes from. I’ve lived in complete social isolation since then, wallowing in my hatred. 

But I also wallowed in my self pity. Where does this self pity come from ? From my childhood, when I was abused by my parents. From this time, I developped this strategy to get the love I never had. Display a show of suffering and agonizing pain in the hopes that someone will have pity of me and help me / give me some love and affection. 

But obviously, it doesn’t work. I don’t know why but that’s what happens in my experience. It just doesn’t work. 

So the incel mentality allowed me to fuel those two behaviors I was beginning to form. Posing as a victim and hating people in general. 

Now I think the incel mentality is wrong. I think what the incel community preach is partly wrong. I didn’t use this mindset because itw as true, I used it because it allowed me to do what I wanted : whining and hating. 

According to incels theory about looks, I am a 3 out of 10 at best. I’m ugly, and it’s a miracle I’m not a virgin, and I have zero chances to ever have any romantic or sexual life ever.   
 I believe that they are right about my uglyness. I do believe they are right and I’m ugly.   
 But if I’m being honnest for a moment, I can’t seriously and honnestly believe that they are right when they talk about the consequences of me being ugly. Why ? Because of real life proofs that shows the contrary. And sorry but there is just too much of these proofs. 

I’ve had girlfriends. When I go out and meet new people, I have girls showing interest in me. Now, why are they interest in me ? That’s the question but that’s a topic for another day. All that matters is that they are. 

So I don’t really believe in the incel mentality, so why exactly did I choose to adopt it ? 

You see, the reason why I have zero romantic life is because I choose to. Back in 2013/2014 I made the decision to not have any women in my life anymore. 

If I don’t have any love life now, it’s not because the universe is mean and made me ugly, it’s not because women are shallow and mean, discriminating against ugly people, it’s because I choose not to have any love life. 

Even when women were attracted to me, I rejected them despite being heavily attracted to them. 

Having no girlfriend is my choice, a consequence of my choices and actions, and not the consequences of some external forces that are out of my control. 

Now, of course, I won’t get super hot models, I won’t get a lot of girls. But I know I can get some average looking women from time to time. Getting hot girls all the time is either for very rich or very hot guys. 

The thing is, by adopting the incel mentality, I basically gave up all my power on my life and on myself : 1) it’s not in my control, it’s all in my genes and I can’t do anything about it and 2) anything I do won’t be enough to go past the limitations set by my genes. That way, I can complain, I can feel like it’s unfair, I can whine, have self pity parties, I can blame the world, hate everybody. 

My goal never was to have a fullfilling love life. Incel was just the cherry on top, that gave me a reason for « poor me » evenings and hating other people, that I resent for what the people in my life did to me back in 2013/2014. 

The root issue is what happened at that time. 

What I must work is not on my incel mentality but on those two behaviors. 

To be honnest, I just got the life I chose to have. If I don’t have a girlfriend, it’s not because I’m ugly, it’s because I don’t want one. I could have friends. I could have a girlfriend. I could have a different life. It’s just that I chose to have the life I have now. And I think I would be a lot happier if I were to accept it and recognize it. The reason why I chose to adopt the incel mentality is because it gave me something to whine about and hate something, someone, for.

The life I have now, the life I complain about, is determined by my actions and choices, not by the universe, my genes…and I have this life because I choose to have it. I can have another kind of life. But in blaming other people, my genes, the universe, I make myself powerless to get a new kind of life. 

Now the questions I must ask myself is why do I choose to live life this way ? If it’s my thing then great, so be it. It’s my choice. If it’s not, then I might want to change it. ",This is my story of being an incel and why I think incel is not relevant for me anymore,aqag2e,new,9.0,56.0,56.0,0.0
,This doesn't make girls feel suicidal,aqb53g,new,18.0,36.0,36.0,0.0
,"There's many other reasons for not getting a pap smear, like being afraid of them",aqbn6f,new,14.0,25.0,25.0,0.0
,all the colors of the cock rainbow,aqcrny,new,31.0,31.0,31.0,0.0
,Other incel going nut because of his roommates' sexual life,aqdrvj,new,46.0,83.0,83.0,0.0
,""" I can’t handle that she’s getting dick she doesn’t fucking deserve.""",aqdn1q,new,162.0,388.0,388.0,0.0
,"""That combination (evil and powerful) is especially popular with females.""",aqdlch,new,6.0,20.0,20.0,0.0
,"""When women say they're 'lonely' they still have friends and orbiters talking to them""",aqdjui,new,19.0,38.0,38.0,0.0
,MGTOW defends creeps on r/niceguys because surely OP/women post pictures to purposely elicit sexual harassment,aqctjy,new,19.0,104.0,104.0,0.0
,"""Cum in the washing gel, so when she goes take a bath and clean her roastie from all the cum she will get pregnant and assume its chads""",aqcr4h,new,57.0,116.0,116.0,0.0
,SO. FUCKING. CLOSE.,aqbxda,new,31.0,117.0,117.0,0.0
,"""Chad is superior ... The fact that we realize and accept this doesn’t mean we’re gay- it means we’re AWARE.""",aqbwzk,new,24.0,36.0,36.0,0.0
,"I don’t run around telling Gordon Ramsey that his taste in food is garbage, but then again, I’m a rational person.",aqbwur,new,90.0,96.0,96.0,0.0
,"""The MeTOO movement was a ploy to imprison unattractive people who dared to become successful """,aqbdxt,new,73.0,44.0,44.0,0.0
,""" if you don’t do sports you don’t fucking deserve to live, sports are for men, any man that doesn’t do athletics simply isn’t a man""",aqamq7,new,109.0,78.0,78.0,0.0
,Apparently it's not depression unless you're completely ostracized,aq9ka7,new,30.0,52.0,52.0,0.0
,But we’re just a support group for lonely men...,aq98zn,new,59.0,915.0,915.0,0.0
,Just have eat a truck of protein a day bro,aq96tm,new,20.0,32.0,32.0,0.0
,"""Pass on superior genes"" y'all know there's a thing called birth control right?",aq8tn8,new,128.0,598.0,598.0,0.0
,What the fuck?!,aq8jqe,new,359.0,5271.0,5271.0,0.0
,A lot of people were thinking my last post was satire. Here is another thing I found in his comment history. Red is him of course.,aq7jwg,new,29.0,216.0,216.0,0.0
,Found this in the comments section for the trailer to 1971's Straw Dogs,aq5izu,new,17.0,46.0,46.0,0.0
,The comments are even worse...,aq5fri,new,62.0,47.0,47.0,0.0
,Petition to make Sonic Adventure the official game of r/inceltears,aq5dzs,new,25.0,159.0,159.0,0.0
,This pouting Dementiacel is triggered over women modifying their appearance. Obviously “real men” are so above that.,aq4zrd,new,35.0,39.0,39.0,0.0
,Getting harassed = validation,aq4k5j,new,23.0,18.0,18.0,0.0
,'denying' incels sex = racial discrimination in work places,aq4ho3,new,25.0,52.0,52.0,0.0
,Boys we got one! (In response to a meme I posted a few days ago),aq2kk2,new,36.0,78.0,78.0,0.0
,Equality = Domestic Abuse,aq2hne,new,9.0,25.0,25.0,0.0
,“When I get a girlfriend”,aq2hd4,new,17.0,29.0,29.0,0.0
,Wonder why he can’t get laid,aq286f,new,7.0,22.0,22.0,0.0
,Podcast on incels by Stuff they don't want you to know,aq282t,new,3.0,34.0,34.0,0.0
,"“no one ever wants me.” conversation with my best friend, who i have feelings for. (sorry for low quality)",aptx5p,new,43.0,102.0,102.0,0.0
,So many fallacies,aq46a8,new,43.0,27.0,27.0,0.0
,"Oh yes, those dads have no self respect /s",aq424s,new,36.0,112.0,112.0,0.0
,Incel proposes ending school shootins via prostitution?!,aq37ot,new,158.0,145.0,145.0,0.0
,"Gymcel decides to harass women and says ""Every man should do this.""",aq26ka,new,312.0,3880.0,3880.0,0.0
,Incels celebrate far right fascist censorship in Brazil,aq1u6y,new,25.0,113.0,113.0,0.0
"There's certainly a lot wrong with the incel ideology. In many aspects it's certainly misogynistic, misguided, etc. But a lot of the posts I see also cover something that is not discussed enough: male intimacy.

Take a post in which an incel gets a job for instance. Sure, you get a few run-of-the-mill misogynistic comments in there. But the posters there are offering support to a person who has generally been ostracized his whole life, some even offering to assist him. For people who lack close friendships, support, etc., this space has allowed them to bond through a shared connection (the incel ideology), and it helps them to *cope* with their circumstances and not rope out of despair.

It doesn't help that male weakness is frowned upon in society. Talking about your insecurities/fears about not being desirable is a good way to get labeled as an incel in public nowadays. Therapy isn't accessible to everybody, so these insecurities just foment inside of people, building up. For instance, in one post somebody has put in genuine effort to becoming a better person, but because they can't get a date, it's automatically assumed that they must have a bad personality. 

Posts making fun of people like this reinforce the self-hatred that many of these people have, and only cause them to go deeper down this spiral. There are people out there who have genuinely tried to better themselves and improved themselves in this community, but they are still unable to romantically connect with others. How is it possible to remain hopeful when you've tried your hardest but failed? The only logical conclusion that these people must have is that they're ""subhuman trash"" that have lost the genetic lottery. It's difficult to open up and find an outlet about these things, however, even to close friends. 

The incel community is the result of this: this is a subreddit that validates people's real-life experiences, and gives them a place to vent. Yes, the ideology is twisted. But it's a welcoming community to those who have been traditionally ostracized, much like a cult.

The problem is, I'm finding myself drawn into this cult, despite knowing that it's wrong. It provides me with a sense of solidarity, since I know that I'm not alone in my predicament. It's a forum that openly discusses male insecurities, something that is usually met with scorn or derision. 

How do I get out of this trap? ",How do I get out of the trap?,aq17ru,new,46.0,27.0,27.0,0.0
,annnd now our butts aren't safe.,aq0jdo,new,29.0,50.0,50.0,0.0
,gay people doesn't exist. okay.,aq0g0b,new,43.0,45.0,45.0,0.0
,Some loser thinks I should be beat up because I’m attractive and have friends 😂,apztgl,new,17.0,49.0,49.0,0.0
"To any incels, MGTOWs, and the like who are currently angrily lurking this subreddit:

It has come to my attention that many of you believe that the userbase of our dear subreddit, r/IncelTears, is primarily composed of Nice Guys, White Knights, and other incels in denial. (For the uninitiated, I recommend looking at r/NiceGuys and r/WhiteKnighting to get a few examples of the individuals mentioned.)

I’d like to shatter that belief, for even though I am but a lurker, I’ve read enough Reddit posts to say with utmost confidence... 
WE ARE NOT, AND I REPEAT, *NOT* INCELS IN DENIAL. And for any of you who say that we’re just bluepillers, beta males, cucks, soyboys, NPCs, or whatever other Newspeak-type bullshit you use, I’d like to say this:

At the time of writing, I’m age sixteen, I don’t have a girlfriend, nor do I have any interest in girls or sex. While I *do* want to lose my virginity at some point in my life, that’s pretty much all I want to do, and I can hire a prostitute to do *that.* I might not find my special someone in my teenage years, and I may not find them until my mid-to-late twenties. I’m perfectly fine with that, because while you say all women are “spent” by age thirty, my mother had her oldest son when she was *twenty-nine.* A few years later, in her *mid-to-late* thirties, she gave birth to my sister, and finally myself. Women can never be “used up”. They are *not* objects, and they’re *not* animals, they’re *people* and people *first.* 

The reason that you don’t get laid is because you act like a shitty person. Sure, you might also act shitty because you didn’t get laid, but at any point in your existence you *can* change yourself, and actually try and become a decent and tolerable person. Think about it like this: if you were dying of thirst in the Arizona Desert, and a normal, straight, born-male man kindly offered you a bottle of only the most crystal-clear spring water, you’d probably drink it. He offered you some water because he saw that you needed it. Now think of the potential to self-improve as that water bottle and this subreddit as that kind man. If you go about it like that, you’d realize that it’s silly to turn down advice offered to you, and also to not accept a drink when you’re dying of thirst.

In conclusion, I’d like to say this: we’re giving you advice because we see you as human beings in need of actual help. You’re going nowhere with this self-destructive behavior, and if your IQs are as high as you say they are, then it should occur to you that committing suicide over not being able to get laid, or turning down a possible way to be respected in society is pretty stupid of you. You’d probably surprise yourself with the person you’d become. Who knows? Maybe if you actually take our advice, you might have a better chance of getting laid!

With optimism,
u/GoopDroop",A message for Incels/MGTOW/Whatever,apzj7b,new,189.0,257.0,257.0,0.0
,"""Men are biologically designed to be dominant over women. The only way women can ever rule the society is if they make most of men into complete pussified betas""",aq04uk,new,28.0,63.0,63.0,0.0
,we live in a society,apzkt7,new,22.0,37.0,37.0,0.0
,""" If a 6'2 incel was competing with a 5'9 Chadlite for a foid at a bar, the incel could pick the Chadlite up off the floor and put him somewhere else.""",apz9ka,new,79.0,138.0,138.0,0.0
,"Life itself says NO, NOT YOU and so we must abide by the choices of DNA and genetics to disinherit us from participating in this great chain of life. ONLY CHAD, ONLY WOMEN screams life.",apyzon,new,20.0,28.0,28.0,0.0
,Does this belong here?,apyu9w,new,103.0,634.0,634.0,0.0
,"They may not literally be killing you like stabbing, but they are indirectly killing you out of the gene pool by not showing interest/selecting you [...] Your lineage/family line/genetic propensity: dead.",apyudz,new,29.0,25.0,25.0,0.0
,How dare she not want to be with such a highly iq-ed individual! The tragedy!,apyfp1,new,43.0,78.0,78.0,0.0
,"""Women are biologically inexperienced, so they make childish and destructive choices""",apymyo,new,13.0,29.0,29.0,0.0
,Cats>Incels,aptqc5,new,16.0,65.0,65.0,0.0
,I found their hometown,apts34,new,15.0,22.0,22.0,0.0
,Found this on Omegle,apvdwf,new,6.0,25.0,25.0,0.0
,On a post regarding middle eastern women,apx4xu,new,11.0,26.0,26.0,0.0
,Fellas is it gay to prefer the male body?,apx638,new,37.0,104.0,104.0,0.0
"So I have a relative hes 25. 
Recently I've been getting worried because he was talking about getting a gun for his job but it isn't necessary .He has a 9-5 in security . im 18 female . He baby sat me for years . He is extremely pessimistic about life always complaining about stuff but he only lights up for anime and japan.He has no friends , doesnt go out , bad hygiene.No hobbies except video games. He is like a child . Also gets aggresive if you disagree with him.When I visit another relative I have to see him and he keeps talking about anime and I just ignore him yet he keeps talking. Like he can't read social cues. What do you guys think, i have a feeling hes gonna do something bad i just dont know when .

Edit -How is this a troll post Lol . He just creeps me out now . Also yeah hes not allowed to get a gun by the rules of the relatives he lives with",Is he an incel???,apxg32,new,8.0,10.0,10.0,0.0
,Just a little MS paint 3d art thing I did.,apxq49,new,8.0,34.0,34.0,0.0
,The comment and responses of an incel on a 'The School of Life' recent video.,apxues,new,5.0,22.0,22.0,0.0
,Guy in FB singles group advised another guy to get into the red pill movement.,apy3oq,new,9.0,22.0,22.0,0.0
,And them another crazy explanation about the same thing,apx83j,new,25.0,47.0,47.0,0.0
,Every explanation they give revolve around Chad,apx78x,new,14.0,27.0,27.0,0.0
,"Yes, women are clearly the entitled ones",apucwy,new,29.0,67.0,67.0,0.0
,Le epic superiority complex has arrived,apuddh,new,32.0,122.0,122.0,0.0
,"More recruitement ""attempt"" PMs from Incels.",aput2y,new,28.0,24.0,24.0,0.0
,"""An Indian man being 5’3 means he will be unable to find any sort of love in the West""",apumpf,new,70.0,39.0,39.0,0.0
,""" they'll always assert that females being objectified and constantly harassed is a lot worse than males being lonely or forced into a miserable life of celibacy...""",apu0kb,new,29.0,62.0,62.0,0.0
,"""people who are anti-blackpill and shit on these types of communities are actually some of the biggest close minded bigots you'll meet. They don't even have the nerve, balls or open mindedness to consider the stuff we say here""",aptz34,new,41.0,47.0,47.0,0.0
,Did you know this is literally ALL women?,aptptw,new,218.0,618.0,618.0,0.0
,Well my first time on 4Chan had been going nicely.,aptf7a,new,419.0,5098.0,5098.0,0.0
,Incels REEEE about Sweden,appiqp,new,52.0,48.0,48.0,0.0
,Incel or Nazi?,appicu,new,36.0,42.0,42.0,0.0
,Incel is happy because of IncelTears!,aplx9d,new,26.0,78.0,78.0,0.0
,Saw this on the tumblr redit,apnfbp,new,274.0,5545.0,5545.0,0.0
,Was told it fits here,apo0jb,new,52.0,181.0,181.0,0.0
,"""I can't get pussy and that's why I have neck strain and a cough""",aplsbw,new,45.0,37.0,37.0,0.0
,Big old yikes from this one.,apl3de,new,103.0,1199.0,1199.0,0.0
,Single Moms Have It Too Easy They Should Be Taxed,apflmw,new,42.0,33.0,33.0,0.0
,Incel wants to introduce his nephew to the blackpill ASAP,apgcat,new,29.0,84.0,84.0,0.0
,Found one waaaaay out in the wild.,apkn5j,new,9.0,18.0,18.0,0.0
,Depression Olympics,apkg0j,new,22.0,30.0,30.0,0.0
,tell me what you celebrate...,apjqbf,new,96.0,110.0,110.0,0.0
,"""Realize that neuroscience is debunking the very concept of free will and that probably we are not that different from animals in how we act""",apj89o,new,27.0,39.0,39.0,0.0
,Incel thoughts on Valentine’s Day,apiofx,new,120.0,91.0,91.0,0.0
,MGTOW thinking that they are being humble.,apgklh,new,30.0,109.0,109.0,0.0
,Don’t you dare touch my future wife!,apgwfd,new,37.0,471.0,471.0,0.0
,"No way, he wanted a private wedding… Fucking beta",aphc3q,new,44.0,166.0,166.0,0.0
,"""I feel like only secretly gay or bisexual men are attracted to black women""",aphbbb,new,91.0,123.0,123.0,0.0
,Imagine an Incel who doesn’t socialize and hates women telling someone to “Get a life”.,apgcpm,new,1.0,11.0,11.0,0.0
,Again the transphobic analogy,apfskb,new,563.0,6338.0,6338.0,0.0
,"""The genes that cause Chad to have tall height, symmetry, thick hair/brows, a defined jaw and a built frame are the same genes that cause him to be talented, intelligent, assured, and charismatic.""",apfmz6,new,54.0,63.0,63.0,0.0
,"""of course stable women with husbands and control are happier""",apfk02,new,9.0,37.0,37.0,0.0
,"""there is a bigger conspiracy at play here in terms of the shit they put in our food. Turn the men into dumb weaklings, destroy the White race, matter of fact, destroy ALL races except of course certain chosenites""",apfin5,new,57.0,86.0,86.0,0.0
,"Does hymen rhyme with diamond? Not trying to spread the word, but this made me laugh a bit...",apf8lw,new,107.0,190.0,190.0,0.0
,"Comment on the Daily fail under an actresses wedding, does it belong here? Seems fitting under the ‘I hate women’ quota",apevfx,new,7.0,37.0,37.0,0.0
,Post accusing women of ‘asking for it’ when they go to bars and drink,apelbr,new,12.0,33.0,33.0,0.0
,'Showering is normslime',apegv8,new,74.0,334.0,334.0,0.0
,Women should be home making babies,apdrvj,new,79.0,354.0,354.0,0.0
"There's no strict limit over what types of advice can be sought; it can pertain to general anxiety over virginity, specific romantic situations, or concern that you're drifting toward misogynistic/""black pill"" lines of thought. Please go to /r/SuicideWatch for matters pertaining to suicidal ideation, as we simply can't guarantee that the people here will have sufficient resources to tackle such issues.

As for rules pertaining to the advice givers: all of the sub-wide rules are still in place, but these posts will also place emphasis on avoiding what is often deemed ""normie platitudes."" Essentially, it's something of a nebulous categorization that will ultimately come down to mod discretion, but it should be easy to understand. Simply put, aim for specific and personalized advice. Don't say ""take a shower"" unless someone literally says that they don't shower. Ask ""what kind of exercise do you do?"" instead of just saying ""Go to the gym, bro!""

Furthermore, top-level responses should only be from people seeking advice. Don't just post what you think romantically unsuccessful people, in general, should do. Again, we're going for specific and personalized advice.

*These threads are not a substitute for professional help*. Other's insights may be helpful, but keep in mind that they are not a licensed therapist and do not actually know you. Posts containing obvious trolling or harmful advice will be removed. Use your own discretion for everything else.

Please message the moderators with any questions or concerns.
",Weekly Advice Thread (02/11-02/17),apddu4,new,641.0,35.0,35.0,0.0
,Are they finally admitting that the blackpill can kill people?,apct11,new,13.0,44.0,44.0,0.0
,According to them all women are leaches,apbw91,new,17.0,60.0,60.0,0.0
,Not like there's been Queer folk and strong women for generations,apbkaw,new,51.0,57.0,57.0,0.0
,Incel goes on racist rant about woman on side of the road,apav6e,new,43.0,92.0,92.0,0.0
,Incels in a nutshell,apa77z,new,147.0,110.0,110.0,0.0
,"""Being jumped for being a pedophile"" Bro what",ap9ixj,new,47.0,71.0,71.0,0.0
,Incels: „Why are we called misogynistic?“ - Also incels:,ap8gq0,new,80.0,230.0,230.0,0.0
,Disturbing conversations in post from r/braincels,ap8ite,new,17.0,16.0,16.0,0.0
,Are the incels simply out of touch? (OC),ap8jzy,new,9.0,58.0,58.0,0.0
,"""She's a virgin, so she should have sex with ME.""",ap8may,new,36.0,49.0,49.0,0.0
,Imagine being this fucking stupid,ap94w2,new,11.0,23.0,23.0,0.0
,Got my first hate message from an incel and thought I'd share...,ap915n,new,68.0,215.0,215.0,0.0
,I don't know even how to title,ap90b7,new,12.0,8.0,8.0,0.0
,Incel humor,ap8see,new,28.0,24.0,24.0,0.0
,Funny how they always have definitive conclusions about othrr people's fetishes,ap8an3,new,50.0,192.0,192.0,0.0
,Am I the only woman missing out on these privileges?,ap7y0e,new,82.0,223.0,223.0,0.0
,Take the Carpill,ap7r2k,new,48.0,37.0,37.0,0.0
,I feel bad for OP,ap7qxp,new,6.0,22.0,22.0,0.0
,Little boys know the truth,ap7wz8,new,12.0,55.0,55.0,0.0
,Now their mad at wholesome memes!!,ap7qdk,new,21.0,64.0,64.0,0.0
,They talk about camgirls like they were 30% of the female population or their industry was half of the GDP,ap7545,new,31.0,91.0,91.0,0.0
,Coming from people who don't have any teenage-related obsession /s,ap6yzu,new,40.0,62.0,62.0,0.0
,The worst theory you'll read today,ap6s5l,new,22.0,68.0,68.0,0.0
,Everyone went quiet but not because you dropped knowledge about the racepill. It's because you are racist.,ap68gp,new,54.0,110.0,110.0,0.0
