selftext,title,id,sorted_by,num_comments,score,ups,downs
"Warning: long ramble ahead.

I am a pre-transition trans female with Asperger's, and I am 17.

I have a perception that nobody likes me, because people often signal ""your comfort doesn't matter to me"". For example, I have to go to massive social events just to see my so-called friends, because they are usually too busy to spend some time specifically with me. I have to dress up, get out into society, get stared at by tons of people just to receive some  compromised small talk about some ordinary life.

I am gifted, and according to the psychotherapists who examined me, my giftedness is at 1 in 320'000. By the distribution curve, this means I have a ""neurotypical IQ"" of about 168. ([This is why](https://www.wolframalpha.com/input/?i=normal+distribution&assumption=%7B%22F%22,+%22NormalProbabilities%22,+%22sigma%22%7D+-%3E%221%22&assumption=%7B%22F%22,+%22NormalProbabilities%22,+%22pr%22%7D+-%3E%221%2F320000%22&assumption=%7B%22FVarOpt%22,+%222%22%7D+-%3E+%7B%7B%7D,+%7B%7B%7B%22NormalProbabilities%22,+%22mu%22%7D%7D%7D,+%7B%7B%22NormalProbabilities%22,+%22pr%22%7D,+%7B%22NormalProbabilities%22,+%22sigma%22%7D%7D%7D&assumption=%7B%22C%22,+%22normal+distribution%22%7D+-%3E+%7B%22Formula%22,+%22dflt%22%7D), 4.518\*15 + 100). In reality I don't like the fact that my rare quality is mental, as opposed to having something attractive on the outside that can produce self love. I always have to explain.

People say ""Find people of your interest"". Well, most people of ""my interest"", that is astrophysics, are usually busy with their life because they somehow don't have life problems. Nobody wants to pull a socially inept person out of bad socialization. I also have difficulty writing this post, because I have a ""societal debt"" of unresolved violence and abuse from Asperger's. 

It also doesn't help that I am pre-transition. I see cis girls of my age posting how pretty they are, and I realize that by the time my transition is complete I will become a ""roastie"" how incels tend to say. Older women had a tendency to be grooming and abusive, so I don't want to see one in a mirror as soon as I am done glowing up.

Even the cis girls that are considered ""1/10"" can be made really attractive, something I learned as a trans girl.

In general, **I hate that I have to compromise my personality, and be someone I am not, just to receive basic social interaction.** This is called ""cope"" in incel slang.

\---

I started being an ""incel"" around the age of 14, when I started experiencing a lot of domestic violence and needed a girlfriend to compensate for it. I used to be extremely ""bluepilled"", in slang. I used to believe that someone will love me. But then I asked, who will want to date me if I am a beta numale and a ""domesticviolencecel"".

I thought that being trans was just a result of not having a father figure, and it could be manned away. But the hard pill, it was not. After that, I was a ""translesbiancel"". I have a large amount of ""attention debt"" from unrequited love and interaction, which makes new friendships not as exciting. I miss certain people that were in early teens. I wish I could have a mental illness that would attract empathy and pity, but my brain is too solid for that. I think that I am only 5-6 years old by social skills.

I think that my ""socialization suppliers"", because I struggle to call them friends, don't really make effort to be friends with me. To me it seems like even in friendship people want somewhat ""Chads"" and ""Stacies"" because nobody wants a lame autist.

Advice appreciated.","Advice needed: 1 month clean from inceldom, but my ""friends"" make me want to relapse.",ao694d,new,18.0,14.0,14.0,0.0
,what a slogan in the end,ao82dd,new,24.0,38.0,38.0,0.0
,He’s real!,ao70x8,new,14.0,247.0,247.0,0.0
,"""she doesn't love you. She will forever love the highschool and college Chads who pounded her when she was young and beautiful""",ao7iaw,new,54.0,86.0,86.0,0.0
,""" Even if I were to ascend and find a woman my age to treasure, our relationship would not be based around love - which I am convinced women are unable to feel after the age of 19.""",ao7cfc,new,40.0,41.0,41.0,0.0
,"""they deny/don't know about these truths because they aren't in the same shoes as ours""",ao6ak2,new,20.0,31.0,31.0,0.0
,Coming from someone that lives in an echo chamber this doesn't really mean much,ao60tk,new,53.0,132.0,132.0,0.0
,"Incel proposes a plan to genetically engineer women in order to fix females as the ""female gender is the most vile, evil and least empathetic gender ever""",ao5yka,new,40.0,42.0,42.0,0.0
,Never forget the time when wife beating was considered normal and even encouraged,ao5s9g,new,56.0,134.0,134.0,0.0
,Oh my GOD!! More delusional bullshit!,ao5fbn,new,32.0,70.0,70.0,0.0
,Calling someone pathetic when you're an incel is possibly the stupidest move you could make,ao5crj,new,35.0,84.0,84.0,0.0
,Didn’t reply to him except for a few times and he’s still here,ao3ueq,new,9.0,17.0,17.0,0.0
,"A few days ago, I received a lovely PM from an Incel because of my flair.",ao3ie5,new,27.0,92.0,92.0,0.0
,Found this on r/niceguys. It's like an Incel in the making,ao23ep,new,35.0,117.0,117.0,0.0
,Mental gymnastics,ao3vnw,new,52.0,281.0,281.0,0.0
,"If she says no, scald her!",ao3lrz,new,641.0,8107.0,8107.0,0.0
,Genius from MGTOW suggests we ban women from voting,anzcvm,new,120.0,118.0,118.0,0.0
,Intel wasn't that open to differing opinions.,ao01og,new,19.0,61.0,61.0,0.0
,[Shitpost] They now sell the bottled essence of this sub,ao00ay,new,12.0,201.0,201.0,0.0
,Whores and Cucks,ao02k4,new,35.0,195.0,195.0,0.0
,"Incel sees an active shooter at a university trending and hopes it's ""one of ours""",ao04lv,new,16.0,96.0,96.0,0.0
,Incel wishes they had gotten laid at 13 because sex is less valuable with age,anzyzf,new,134.0,496.0,496.0,0.0
,i... i can't even comment on this,anz1gy,new,14.0,104.0,104.0,0.0
,They cannot be serious.,anxpr5,new,91.0,780.0,780.0,0.0
,When an incel explains what happens to someone’s genitals after they have sex,anylhh,new,2.0,71.0,71.0,0.0
,Incels don't represent danger at all /s,anxxph,new,10.0,20.0,20.0,0.0
"TW: SEXUAL HARASSMENT


Hello everyone! If you've been on IT for a while, you have probably seen Incels' ""Tinder Experiments"", in which they set their profile picture as a ""Chad"" and start saying asshole things to women, but women respond positively ""bECaUsE iT'S cHaD!!!""

I have my doubts with these ""experiments"", especially since it doesn't seem like they include every trial - only that ones that ""work"". So, I'm doing my own Chad challenge.

I have set up a tinder account, my profile has 4 pictures of Francisco Lachowski. All my profile says is ""6'3"""".

I'll try to attach screenshots where I can, but when people unmatch me, I lose the chat. Thus only some posts have screenshots.

..........

GIRL #1: 

Me: Hey, what's up?

Girl 1: I'm cleaning up my room haha

Girl 1: Wbu?

Me: I'm not doing much tbh

Me: But I'd like to do you

G1: Oh I'm sure you would

Me: What size are your tits?

G1: Wouldn't you like to know

Me: Aw come on, don't tell me you're a prude

*unmatched*

..........

GIRL #2:

Me: What's up? Ur cute 

G2: Just scrolling with a Netflix background, real exciting stuff. And thanks. Wby?

Me: Lol not doing much tbh

Me: How big are your tits?

*ghosted*

Screenshot: https://imgur.com/PP0Gu8y

..........

GIRL #3:

Me: Hey, what's up?

G3: Just chillin with my fam hbu??

Me: Not doin much tbh

G3: Lol that's fun

Me: You look like you would be fun

G3: Oh really??

Me: Mm yeah, can just picture your tight ass

G3: Woah ok

Me: How big are your tits?

G3: Uhmm none of your business

Me: Aw I'm just trying to get to know you cutie

G3: There are plenty of other ways to get to know someone just an fyi

Me: Come on. I'm hot, you're hot, let's get together. I know you want to

G3: No way buddy

Me: Why not?

G3: Bc I do not do that

Me: Why? Ur a prude?

G3: I don’t have to explain my choices to you.. I don’t do that and that’s all I’m gonna say about it

*unmatched*

..........

GIRL #4:

Me: Hey

G4: How you doing?

Me: I'm pretty good, been taking the day off. What you up to?

G4: me too, i bet your classes were cancelled ( *there was bad weather in my area, so we had a snow day* )

Me: Yep it was fucking sick, loved it. It's all bullshit anyway so I didn't miss much. So what do you like to do?

G4: What r u studying?

G4: I like to play sports for fun, play a little guitar, surf through netflix

Me: You sound like fun ;)

Me: Question, wanna fuck?

*unmatched*

..........

GIRL #5:

G5: *sent a gif*

Me: Lol cute gif. Ur cute too actually.

G5: Not bad yourself

Me: ;) Your skin is pretty, white skin is honestly the best. I can't stand any other colour, looks dirty.

Me: Your hair is pretty too. Natural blonde?

G5: Guess it's a good thing I burn, not tan

G5: Natural dirty blonde

Me: Nice love it. What size are your tits?

G5: My real ones or my fake ones? 

Me: You have fake ones? ( *I'm genuinely confused here haha* )

G5: Yeah 🤷‍♀️

Me: Tell me both

G5: *tells me real size*

Me: Holy shit. Gonna be blunt, we gotta fuck.

G5: Mm, not before I know how big your dick is.

Me: Wow, I can tell you've been fucked a lot.

G5: *She ignores the rude comment and asks again for my size.*

*I realize this conversation is going downhill, as she keeps trying to hook up with me despite my rudeness.*

Screenshot: https://m.imgur.com/gallery/syG9GdP
..........

GIRL #6:

Me: What you up to babe?

G6: Just watching TV u?

Me: Job searching, trying to find something that doesn't need a background check lol

G6: Lmao what did you do??

Me: Lol its a secret, but Ill trust you

Me: I used to get angry and my ex is such a bitch. So I got in shit for beating her up. Spent some jail time.

Me: Dumb bitch deserved it tbh.

G6: Holy fuck

G6: You can't beat women up no matter how angry you are

Me: Only if they give lip

Me: Pretty sure she was cheating on me

*ghosted*

Screenshot: https://imgur.com/a/n8qKZqI

..........

GIRL #7:

Me: What's up? Ur cute

G7: So are you! I'm just watching tv with my friends and her kids. You?

Me: I'm fantasizing about you and your tight ass ;)

*ghosted*

Screenshot: https://imgur.com/a/UDMPeWN

..........

GIRL #8:

Me: Wow ur sexy

G8: Thanks 😊

Me: What size are your tits?

*unmatched*

..........

GIRL #9:

Me: Hey whats up

G9: Not much hbu :)

Me: Im in class lol not paying much attention

Me: How big are your tits?

G9: Don't ask me stupid shit.

Me: Not stupid, getting to know you

G9: That's not a question to ask me then lmao

Me: aw, are u a prude?

G9: No, just allergic to fuckboys

Me: Come on, you know you want to screw ;) lets meet up 

G9: I'll pass, you're already annoying as fuck

*unmatched*

.................

I will update as we go along. I think I'll go to about 10.

Chad's progress:

1 Success

8 Rejections","""Women love being sexually harassed by Chad."" - Playing Tinder as Chad the Asshole! 💁‍♂️",anx9y5,new,145.0,27.0,27.0,0.0
,Because no short man has a faithful wife /s,anx1km,new,231.0,2774.0,2774.0,0.0
,Incel logic,anwu5p,new,20.0,123.0,123.0,0.0
"&#x200B;

https://i.redd.it/2bq6h1l5pze21.jpg",What they resort to when they're cornered in an argument,antn36,new,20.0,13.0,13.0,0.0
"You're desperate, you're lonely, and you want to know what it's like to not be.

So what do you do?

You start hating the people that ARE as desperate and lonely as you. Better yet, why not totally invalidate them all.  Stereotype them. 

After all of that is done, continue wondering how exactly you're still in the same fucked up situation.



I have to say honestly, at this point, being an incel of any gender is starting to make me stereotype them. You already see how much shit comes out of the Male dominated incel subs. Ever taken a look at r/trufemcels ?
They aren't as bad. They are supportive, but the behavior of male incels still is similar in them. Hating and stereotyping incels right off the bat? Check. 


At times you will see posts that are similar to the ones on here. Mocking some incel that has said some retarded shit. Except that it isn't uncommon to see random comments like ""all men are vile"" upvoted many times on those types of posts. 

I mean, yikes. Lovely thing you got going on there incels. It would almost be romantic  about the way they hate each other if it weren't for the fact that it's  so sad.
",Just Imagine,anux9a,new,2.0,1.0,1.0,0.0
,Damnit Erik!,anv0j2,new,5.0,40.0,40.0,0.0
,"Always with the calling of single mothers ""degenerate"", sigh...",anvt88,new,17.0,6.0,6.0,0.0
,"In Brazil, that gesture was also used by a teacher in a sitcom, who always complained about his wages",anwhao,new,12.0,30.0,30.0,0.0
,Now incels can predict future,anuutn,new,96.0,190.0,190.0,0.0
,"Oh, the high school obsession",anulev,new,36.0,37.0,37.0,0.0
,""" Develop whatever fucking talent you want to, be the smartest faggot at your school, whatever it is you do there is someone equal, but better looking""",anuk7q,new,14.0,21.0,21.0,0.0
,"""if you make a plastic surgery and find a wife, NEVER have sons""",antmli,new,14.0,50.0,50.0,0.0
,"""men are judged purely on things they cannot control and it's social suicide if you as a male are found to be wearing lifts or makeup or anything like that""",anthlr,new,25.0,33.0,33.0,0.0
,"""[Women] want to humiliate you. Convince you to turn gay. Lock you in jail. Have someone kill you. Or tease you the point where you kill youself""",ant8yx,new,48.0,33.0,33.0,0.0
,When you think peaking in high school is the best thing ever. Lol,ansizc,new,271.0,863.0,863.0,0.0
,aLl WoMeN ArE wHoREs!,ansgkj,new,27.0,168.0,168.0,0.0
,Incel praises guns as the ultimate incel invention. Hopefully now on a government list,ansamp,new,55.0,83.0,83.0,0.0
,You can replace therapy with a $6 Udemy course for example,anry6i,new,11.0,26.0,26.0,0.0
,"Another round of ""I wonder why the girl rejected this incel?""",anrxue,new,84.0,330.0,330.0,0.0
,"""we started life on Game Over mode""",anruzs,new,11.0,39.0,39.0,0.0
,"Don't know if this belongs here, but he's taking about the women elected to Congress...",anrd4b,new,27.0,174.0,174.0,0.0
,4chan is a blight upon society,anqtru,new,33.0,64.0,64.0,0.0
,"Of course ""femoids shouldn't have rights"" was the conclusion of a recent peer reviewed study /s",anqp23,new,98.0,162.0,162.0,0.0
,"#nowplaying ""David Bowie - Strawman""",anq6k7,new,7.0,18.0,18.0,0.0
,"""We have enough IQ to fully understand that life is not the same anymore, it is corrupted and rigged towards women""",anpzq3,new,5.0,9.0,9.0,0.0
,A comment on a video about bad women drivers (I just like watching the drama and road rage),anpucw,new,21.0,145.0,145.0,0.0
,Incel humor,anpvkt,new,394.0,6582.0,6582.0,0.0
,Priorities,anprbd,new,103.0,417.0,417.0,0.0
,It isn't possible that people on that sub are dumb enough not to understand the meaning of the statement,anpmuz,new,23.0,89.0,89.0,0.0
,Back to the void I go,anodsw,new,25.0,898.0,898.0,0.0
,Dude thinks school shootings will stop if the government assigns him a girlfriend (Hint: It Will Not),anmofu,new,188.0,1642.0,1642.0,0.0
Me incel https://imgur.com/gallery/eobVvbr,My Conversation with an incel.,ann5ep,new,37.0,23.0,23.0,0.0
"I found this new sub today:

&#x200B;

https://i.redd.it/im7niam0pve21.png

They don't call themselves incels, but they use incel slang as their language.",Do these guys count as incels?,ann6ku,new,11.0,10.0,10.0,0.0
,Wait...What?!,anmyu0,new,28.0,106.0,106.0,0.0
,‘Men surpass women in everything’,anhnhy,new,26.0,43.0,43.0,0.0
,"Not only victim-shaming, but also not understanding how sexual abuse works",anliqs,new,9.0,75.0,75.0,0.0
,This guy redpilled his son...,anm3ju,new,560.0,4736.0,4736.0,0.0
,Commented on a screenshot of a female saying some really messed up stuff about men having no compassion or feelings ect. He doesnt post in any incel forums but his comments history was definitely full of incel defending.,anja6y,new,27.0,21.0,21.0,0.0
,Because Evolution ans Social Darwinism are the same thing /s,anje1n,new,81.0,172.0,172.0,0.0
,"""Allowing females to control reproduction by having a 100% veto via the fiction of 'consent' is simply individual eugenics""",anj3r5,new,33.0,74.0,74.0,0.0
,"""Now suppose that was all real. Despite attaining what 99% of humanity would consider to be the ultimate goal, they spend all their time harassing, attacking, and vilifying the socially oppressed and downtrodden on an anonymous platform.""",anir90,new,27.0,49.0,49.0,0.0
,"Why, Shaggy",and2jy,new,14.0,36.0,36.0,0.0
,Incel Infighting! (the nohomo question went unanswered),and7og,new,10.0,28.0,28.0,0.0
,Here's a good tip: Don't try to fuck kids,ane2cf,new,28.0,51.0,51.0,0.0
,Some Reverse Logic,ane3mf,new,10.0,33.0,33.0,0.0
,Incel thinks all women are crazy and manipulating,aneqq4,new,3.0,24.0,24.0,0.0
,Incel's new slogan,anfezg,new,1.0,17.0,17.0,0.0
,YouTube is just a goldmine,angkeo,new,7.0,35.0,35.0,0.0
,Incel gets upset with self-service checkout worker,anhsx4,new,40.0,278.0,278.0,0.0
,The Incel Scale,ani7bg,new,67.0,323.0,323.0,0.0
,Found this at r/braincel,ani91z,new,28.0,251.0,251.0,0.0
"My girlfriend used to be friends with a guy that let’s call H and a while back H started acting weird and depressed and constantly talking about how he’s short and no one will ever like him, and for a while we heard nothing from H until he started visiting my girlfriend and I at lunch again. we want to support him and it sounded like H was doing better until he said that he is a mod on a black pill forum, realizing he was part of the incel community explains why he was saying things like shortness is a disease and stuff. I don’t want someone who seems like a good person to get caught up in that community and now I find out he’s moderating one, is there anything I can do to help?","Someone I know told me they are the mod for a black pill forum, what should I do ?",ani75r,new,9.0,25.0,25.0,0.0
,Nurse boy gets heckin mad (Pt. 2),anh6qh,new,31.0,99.0,99.0,0.0
,"""Getting a girlfriend is not ascending""",anh6gu,new,20.0,49.0,49.0,0.0
,Nurse boy gets heckin mad. (Pt. 1),anh6ee,new,138.0,485.0,485.0,0.0
,"""Women hate god for distracting men from worshipping their vaginas. Satan hates men and allies with women in order to destroy the soul of man""",anh63z,new,29.0,86.0,86.0,0.0
,They’re encouraging suicide. I have no other words.,anfhr6,new,9.0,41.0,41.0,0.0
,"How can they take the ""manlet"" meme so seriously",angsl0,new,69.0,34.0,34.0,0.0
,I cackled. This is great!!! Keep it dweebs. -🖤🖤 Thot boy,angixi,new,45.0,192.0,192.0,0.0
,Kid blames women and his Crohn's Disease (his disability) as to why he doesn't get dates,anfsub,new,30.0,38.0,38.0,0.0
,Just turn society into a cult bro,anezb0,new,17.0,36.0,36.0,0.0
,"""in the short span of a few decades, the delusional liberal cucks shat over 10 000 years of human civilization and have started the descent""",aneewd,new,21.0,25.0,25.0,0.0
,"""any ancient high IQ family would have disposed of their foid and kept their male children.""",andtid,new,33.0,27.0,27.0,0.0
,He asked to see her feet...,andk98,new,51.0,155.0,155.0,0.0
,"""inceldom is the ultimate counter culture""",andhr4,new,18.0,43.0,43.0,0.0
,They simply don't understand the idea of a man supporting feminist ideas because he agrees,andavv,new,27.0,18.0,18.0,0.0
,Let's count the amount of errors,and0la,new,25.0,77.0,77.0,0.0
,"""Shrek is jew propaganda to promote girls to disobey their parents and fuck with savage apes.""",anct0r,new,62.0,185.0,185.0,0.0
,Imagine if they invested that time into doing something positive. . .,ancr9w,new,474.0,11308.0,11308.0,0.0
,Still obsessed with me,anca2s,new,15.0,35.0,35.0,0.0
,Either they aren't good enough or they're better than everyone.,anbqqj,new,31.0,87.0,87.0,0.0
,This is distressing and also concerning!! Notice how no incel is trying to talk him out of it!!,anbqke,new,44.0,43.0,43.0,0.0
,The original post was about only women wanting hookups,anbnel,new,24.0,29.0,29.0,0.0
,"Do you get your period every month? You must be a pathetic, inferior animal. -Incels",anb7ex,new,13.0,48.0,48.0,0.0
,Entitlement of incel woman in all its glory,anb4nv,new,17.0,0.0,0.0,0.0
,4chan user talks about his prefrrences,anb34u,new,41.0,53.0,53.0,0.0
,Hates on women for being single mothers..”omg why am I the bad guy for being a bad guy?!!!”,anawgc,new,6.0,19.0,19.0,0.0
,Does this belong here?,anagy5,new,21.0,14.0,14.0,0.0
,Kbnoswag blog The Internet's Absolute Worst: A Shallow Dive into Incel Culture,anaa6g,new,2.0,6.0,6.0,0.0
,Posted about a book im reading...apparently im an attention seeking thot,ana1h1,new,3.0,26.0,26.0,0.0
,Hhmm so living in the last century uh?,an9ygt,new,4.0,15.0,15.0,0.0
,When you're so bitter that positive posts piss you off:,an8zp5,new,18.0,30.0,30.0,0.0
,On a video about a woman being murdered for rejecting a man (excuse the poor handwriting),an7pzx,new,5.0,9.0,9.0,0.0
,Youtube comments at their best,an6k67,new,2.0,10.0,10.0,0.0
,Fun philosophical question,an2ywa,new,2.0,8.0,8.0,0.0
,I hope every Incel finds their Chad one day 💓,an2npd,new,11.0,65.0,65.0,0.0
,On female circumcision,anbt22,new,56.0,85.0,85.0,0.0
,Ooooooooofffff!,anao0b,new,29.0,42.0,42.0,0.0
,"""Going their own way"" = body shaming an ex and obsessing over her weight.",ana2md,new,37.0,61.0,61.0,0.0
,"Truly delusional, accusing a baby of greed and female privilege.",an9zq5,new,65.0,987.0,987.0,0.0
,Just make a science salad bro,an9k8n,new,13.0,12.0,12.0,0.0
,"Incel hot take:women like tall men because they enjoy being badly beaten, if they didn't, they would date smaller men to avoid harm when he inevitably abuses them.",an96n6,new,109.0,58.0,58.0,0.0
,Charming. Also calling me a whore isn't offensive. I literally refer to myself as a thot. 🤷🏾‍♂️,an8xa2,new,28.0,72.0,72.0,0.0
,They’re literally just mad that she’s pretty...,an7bvx,new,84.0,339.0,339.0,0.0
,Reminder that these are the same people who call us “assholes” for having basic decency.,an8amz,new,67.0,281.0,281.0,0.0
,"""Chad is the pinnacle of humanity, the being that we all wish we could be, femoids included""",an89z6,new,43.0,58.0,58.0,0.0
,"""I try to be as anonymous as possible because I know that once they see my face they will automatically downgrade whatever I've done, even be disgusted they praised it at all""",an7r1y,new,14.0,27.0,27.0,0.0
,"""These comforting lies such as 'looks dont matter' or 'any dick size can satisfy a woman, it's just how you use it' are social constructs of rulers of empires""",an7fhq,new,28.0,15.0,15.0,0.0
,Look! A selfawarewolf!,an79a9,new,38.0,355.0,355.0,0.0
,"Incels finally become a Church, do you think that they could get tax exemptions? /s",an31v3,new,7.0,18.0,18.0,0.0
,"Why incels are so obsessed about the fanfic of men who disagree with them, play console games and have cuckold fetish?",an6mfx,new,154.0,283.0,283.0,0.0
,"The 5'11"" 'midget'",an4sym,new,47.0,81.0,81.0,0.0
,Huh? Wonder why you can't get laid...,an486y,new,447.0,3681.0,3681.0,0.0
,"""Women CANNOT love, they do not have the biological ability to feel such a thing""",an3x6m,new,88.0,145.0,145.0,0.0
,Oooooof.,an3ni5,new,29.0,101.0,101.0,0.0
,Incel apparently watches his parents have sex regularly,an2eu7,new,64.0,924.0,924.0,0.0
,Came across one in the wilds of YouTube.,an2cv3,new,45.0,177.0,177.0,0.0
,A incel’s view on sexual assault,an28wy,new,52.0,226.0,226.0,0.0
,Found on r/instagramreality - on a post of a girl's unedited pictures showing cellulite,an23kw,new,9.0,36.0,36.0,0.0
,"Found On That ""My husband came out as trans"" Video",an16vy,new,18.0,47.0,47.0,0.0
,"""5 myths about the vagina."" #1 is the main reason I'm posting this, but 2-4 are worth knowing. (#5 is just wrong)",an2c0m,new,10.0,25.0,25.0,0.0
,"""You're a ""really great guy"", but now that she's felt those tingles, there's no going back. You don't, and could never, turn her on the way he does""",an1lhh,new,40.0,55.0,55.0,0.0
,Al-Inceli 4:20,amzphf,new,15.0,60.0,60.0,0.0
,"Woman comes forward with rape allegations:""She's a lying whore! He's innocent until proven guilty!"" ..Case gets dismissed:""She's a lying whore, he's innocent! Give her a life sentence or kill her!""",amzni7,new,89.0,74.0,74.0,0.0
,Incel organ donor should be allowed to fuck female corpses lol,amzit1,new,74.0,205.0,205.0,0.0
,When your misogyny is so strong even other incels think you're extreme,amziht,new,389.0,10342.0,10342.0,0.0
,r/TheRedPill Is Feminism,amzdvb,new,12.0,45.0,45.0,0.0
,Mental health gatekeeping,amz6rb,new,61.0,298.0,298.0,0.0
